,title,address,project_name,apartment_code,block_name,block_code,square,square_area,square_in_use,bedroom,wc,num_floor,floor,width,height,door,balcony,certificates,house_type,estate_type,office_type,apartment_type,status,furniture_status,estate_status,apartment_specific,house_specific,_type,price_m2,price_square
1473,MT TRẦN HƯNG ĐẠO . PHƯỜNG NGUYỄN CƯ TRINH . QUẬN 1,"Đường Trần Hưng Đạo, Phường Nguyễn Cư Trinh, Quận 1, Tp Hồ Chí Minh",[],[],[],[],[],78 m²,[],6 phòng,Nhiều hơn 6 phòng,6,[],4 m,20 m,[],[],['Đã có sổ'],"['Nhà mặt phố, mặt tiền']",[],[],[],[],['Nội thất cao cấp'],[],[],"['Hẻm xe hơi', 'Nở hậu']",[],"282,05 triệu/m²",22 tỷ- 78 m2đ
1474,"Bán nhà chính chủ, hẻm xe hoi tới nhà","88/89, Nguyễn Van Quy, Phường Nguyễn Cư Trinh, Quận 1, Tp Hồ Chí Minh",[],[],[],[],[],81 m²,158 m²,3 phòng,4 phòng,[],[],4 m,20 m,['Tây Nam'],[],['Đã có sổ'],"['Nhà mặt phố, mặt tiền']",[],[],[],[],[],[],[],['Hẻm xe hơi'],[],"60,49 triệu/m²","4,9 tỷ- 81 m2đ"
1475,"Bán nhà Nguyễn Văn Nguyễn,Quận 1,HXH,50m2. 6,6 tỷ.","Đường Nguyễn Văn Nguyễn, Phường Tân Định, Quận 1, Tp Hồ Chí Minh",[],[],[],[],[],50 m²,50 m²,3 phòng,[],4,[],[],[],[],[],['Đã có sổ'],"['Nhà mặt phố, mặt tiền']",[],[],[],[],[],[],[],"['Hẻm xe hơi', 'Nở hậu']",[],132 triệu/m²,"6,6 tỷ- 50 m2đ"
1476,"Nhà HXH Nguyễn Công Trứ, Q.1, 2 lầu, sát mặt tiền","Đường Nguyễn Công Trứ, Phường Nguyễn Thái Bình, Quận 1, Tp Hồ Chí Minh",[],[],[],[],[],44 m²,[],3 phòng,3 phòng,3,[],4 m,11 m,[],[],['Đã có sổ'],"['Nhà ngõ, hẻm']",[],[],[],[],[],[],[],['Hẻm xe hơi'],[],"204,55 triệu/m²",9 tỷ- 44 m2đ
1477,MẶT TIỀN QUẬN 1 CẦN BÁN LIỀN KỀ PHƯỜNG TÂN ĐỊNH,"Đường Hai Bà Trưng, Phường Tân Định, Quận 1, Tp Hồ Chí Minh",[],[],[],[],[],225 m²,400 m²,6 phòng,Nhiều hơn 6 phòng,3,[],[],[],['Tây Nam'],[],['Đã có sổ'],"['Nhà mặt phố, mặt tiền']",[],[],[],[],['Hoàn thiện cơ bản'],[],[],[],[],"422,22 triệu/m²",95 tỷ- 225 m2đ
1478,Nhà Q1 Nguyễn Hữu Cầu 27m2 cn:20 1 lầu 2pn,"Đường Nguyễn Hữu Cầu, Phường Tân Định, Quận 1, Tp Hồ Chí Minh",[],[],[],[],[],27 m²,[],2 phòng,[],[],[],4.5 m,6 m,[],[],[],"['Nhà ngõ, hẻm']",[],[],[],[],[],[],[],[],[],"68,89 triệu/m²","1,86 tỷ- 27 m2đ"
1479,Bán nhà hẻm xe hơi Trần Hưng Đạo Q.1,"Đường Trần Hưng Đạo, Phường Cầu Kho, Quận 1, Tp Hồ Chí Minh",[],[],[],[],[],46.5 m²,93 m²,3 phòng,2 phòng,[],[],4.65 m,10 m,[],[],['Đã có sổ'],"['Nhà ngõ, hẻm']",[],[],[],[],['Hoàn thiện cơ bản'],[],[],['Hẻm xe hơi'],[],"155,43 triệu/m²","7,15 tỷ- 46.5 m2đ"
1480,Bán nhà mặt tiền Nguyễn Văn Thủ Q1 DT 8.5x18m,"Đường Nguyễn Văn Thủ, Phường Đa Kao, Quận 1, Tp Hồ Chí Minh",[],[],[],[],[],150 m²,399 m²,5 phòng,4 phòng,[],[],8.5 m,18 m,[],[],[],"['Nhà mặt phố, mặt tiền']",[],[],[],[],[],[],[],[],[],"333,33 triệu/m²",50 tỷ- 150 m2đ
1481,"Siêu phẩm Góc 2MT Mạc ĐỈnh Chi,Đakao,Q1","Đường Mạc Đĩnh Chi, Phường Đa Kao, Quận 1, Tp Hồ Chí Minh",[],[],[],[],[],21 m²,[],3 phòng,2 phòng,3,[],5.2 m,7 m,[],[],[],"['Nhà mặt phố, mặt tiền']",[],[],[],[],[],[],[],[],[],"690,48 triệu/m²","14,5 tỷ- 21 m2đ"
1482,"Cần bán nhà Bến Chương Dương, đất 30m2 - 7,1 tỷ","TK 2/4, Đường Bến Chương Dương, Phường Cầu Kho, Quận 1, Tp Hồ Chí Minh",[],[],[],[],[],30 m²,48 m²,2 phòng,2 phòng,[],[],2.89 m,10.67 m,['Tây Bắc'],[],[],"['Nhà ngõ, hẻm']",[],[],[],[],[],[],[],[],[],"236,67 triệu/m²","7,1 tỷ- 30 m2đ"
1483,Hẻm 1 xẹt nhà mới vào ở ngay,"trần quang khai, Phường Đa Kao, Quận 1, Tp Hồ Chí Minh",[],[],[],[],[],17 m²,[],1 phòng,1 phòng,[],[],[],[],[],[],['Đã có sổ'],"['Nhà ngõ, hẻm']",[],[],[],[],[],[],[],['Hẻm xe hơi'],[],"105,29 triệu/m²","1,79 tỷ- 17 m2đ"
1484,Nhà bán căn góc 2 mặt tiền đường Trần Khắc chân Q1,"9, Đường Trần Khắc Chân, Phường Tân Định, Quận 1, Tp Hồ Chí Minh",[],[],[],[],[],30 m²,30 m²,1 phòng,1 phòng,[],[],4 m,8 m,[],[],['Đã có sổ'],"['Nhà mặt phố, mặt tiền']",[],[],[],[],[],[],[],[],[],"416,67 triệu/m²","12,5 tỷ- 30 m2đ"
1485,"Bán nhà giá rẻ, khu vực Tân Định quận 1","Đường Trần Quang Khải, Phường Tân Định, Quận 1, Tp Hồ Chí Minh",[],[],[],[],[],63.5 m²,63.5 m²,3 phòng,2 phòng,3,[],3 m,9.5 m,[],[],['Đã có sổ'],"['Nhà ngõ, hẻm']",[],[],[],[],['Hoàn thiện cơ bản'],[],[],['Nở hậu'],[],"61,11 triệu/m²","3,85 tỷ- 63.5 m2đ"
1486,Nhà 8A/Thái Văn Lung Q1. 43m2. 1 trệt 3 lầu 17 tỷ,"Đường Thái Văn Lung, Phường Bến Thành, Quận 1, Tp Hồ Chí Minh",[],[],[],[],[],43 m²,178 m²,8 phòng,6 phòng,[],[],4 m,11 m,[],[],['Đã có sổ'],"['Nhà ngõ, hẻm']",[],[],[],[],[],[],[],[],[],"395,35 triệu/m²",17 tỷ- 43 m2đ
1487,"Nhà 1 trệt 2 lầu 99m2 đường cô giang,p.cô giang,q1","Đường Cô Giang, Phường Cô Giang, Quận 1, Tp Hồ Chí Minh",[],[],[],[],[],33 m²,99 m²,3 phòng,3 phòng,[],[],3 m,11 m,['Đông'],[],['Đã có sổ'],"['Nhà ngõ, hẻm']",[],[],[],[],[],[],[],['Hẻm xe hơi'],[],"181,82 triệu/m²",6 tỷ- 33 m2đ
1488,"BÁN NHÀ GÓC 3 MẶT THOÁNG, HXH - PHỐ TÂY BÙI VIỆN","250, Đường Bùi Viện, Phường Phạm Ngũ Lão, Quận 1, Tp Hồ Chí Minh",[],[],[],[],[],34 m²,34 m²,4 phòng,3 phòng,3,[],[],[],[],[],['Giấy tờ khác'],"['Nhà ngõ, hẻm']",[],[],[],[],[],[],[],[],[],"205,88 triệu/m²",7 tỷ- 34 m2đ
1489,Hẻm 149 Lê Thị Riêng Q1. Giá 6.7 tỷ. 1 trệt 1 lầu,"Đường Lê Thị Riêng, Phường Bến Thành, Quận 1, Tp Hồ Chí Minh",[],[],[],[],[],32 m²,68 m²,2 phòng,2 phòng,[],[],3 m,11 m,[],[],['Đã có sổ'],"['Nhà ngõ, hẻm']",[],[],[],[],[],[],[],[],[],"209,38 triệu/m²","6,7 tỷ- 32 m2đ"
1490,NGUYỄN VĂN NGUYỄN . P TÂN ĐỊNH . QUẬN 1 .,"Đường Nguyễn Văn Nguyễn, Phường Tân Định, Quận 1, Tp Hồ Chí Minh",[],[],[],[],[],35 m²,[],2 phòng,3 phòng,3,[],[],[],[],[],['Đã có sổ'],"['Nhà mặt phố, mặt tiền']",[],[],[],[],['Nội thất cao cấp'],[],[],"['Hẻm xe hơi', 'Nở hậu']",[],"131,43 triệu/m²","4,6 tỷ- 35 m2đ"
1491,"Bán nhà Nguyễn Thị Minh Khai, Quận 1. Giá 4.6 tỷ","Đường Nguyễn Thị Minh Khai, Phường Đa Kao, Quận 1, Tp Hồ Chí Minh",[],[],[],[],[],18 m²,[],3 phòng,[],[],[],3.5 m,5 m,[],[],['Đã có sổ'],"['Nhà ngõ, hẻm']",[],[],[],[],[],[],[],[],[],"255,56 triệu/m²","4,6 tỷ- 18 m2đ"
1492,Bán nhà 174 Bùi Viện (không đăng tin),Đường Bùi Viện,[],[],[],[],[],33 m²,33 m²,4 phòng,3 phòng,2,[],3.3 m,11 m,[],[],['Đã có sổ'],"['Nhà mặt phố, mặt tiền']",[],[],[],[],[],[],[],[],[],"969,7 triệu/m²",32 tỷ- 33 m2đ
1493,✨ ✨ Bán nhà HXH Q1 - Hồ Hảo Hớn - 36m2 - 4.5 Tỷ.,"Đường Hồ Hảo Hớn, Phường Cô Giang, Quận 1, Tp Hồ Chí Minh",[],[],[],[],[],36 m²,36 m²,2 phòng,2 phòng,[],[],6 m,6 m,[],[],['Đã có sổ'],"['Nhà ngõ, hẻm']",[],[],[],[],[],[],[],['Hẻm xe hơi'],[],125 triệu/m²,"4,5 tỷ- 36 m2đ"
1494,Nhà mặt tiền Trần Đình Xu Q1. 4 lầu / thang máy,"Đường Trần Đình Xu, Phường Cô Giang, Quận 1, Tp Hồ Chí Minh",[],[],[],[],[],75 m²,[],8 phòng,[],[],[],[],[],[],[],['Đã có sổ'],"['Nhà mặt phố, mặt tiền']",[],[],[],[],[],[],[],[],[],"346,67 triệu/m²",26 tỷ- 75 m2đ
1495,MT TRẦN HƯNG ĐẠO . PHƯỜNG NGUYỄN CƯ TRINH . QUẬN 1,"Đường Trần Hưng Đạo, Phường Nguyễn Cư Trinh, Quận 1, Tp Hồ Chí Minh",[],[],[],[],[],78 m²,[],6 phòng,Nhiều hơn 6 phòng,6,[],4 m,20 m,[],[],['Đã có sổ'],"['Nhà mặt phố, mặt tiền']",[],[],[],[],['Nội thất cao cấp'],[],[],"['Hẻm xe hơi', 'Nở hậu']",[],"282,05 triệu/m²",22 tỷ- 78 m2đ
1496,"Bán nhà chính chủ, hẻm xe hoi tới nhà","88/89, Nguyễn Van Quy, Phường Nguyễn Cư Trinh, Quận 1, Tp Hồ Chí Minh",[],[],[],[],[],81 m²,158 m²,3 phòng,4 phòng,[],[],4 m,20 m,['Tây Nam'],[],['Đã có sổ'],"['Nhà mặt phố, mặt tiền']",[],[],[],[],[],[],[],['Hẻm xe hơi'],[],"60,49 triệu/m²","4,9 tỷ- 81 m2đ"
1497,".Mặt tiền Nguyễn Công Trứ,Quận 1,72m2 chỉ 5tỷ","Đường Nguyễn Công Trứ, Phường Nguyễn Thái Bình, Quận 1, Tp Hồ Chí Minh",[],[],[],[],[],72 m²,144 m²,3 phòng,2 phòng,[],[],4 m,18 m,[],[],[],"['Nhà mặt phố, mặt tiền']",[],[],[],[],[],[],[],[],[],"69,44 triệu/m²",5 tỷ- 72 m2đ
1498,"Bán nhà Quận 1, 18m2 2 tầng chỉ 1.749 tỷ","Đường Trần Quang Khải, Phường Tân Định, Quận 1, Tp Hồ Chí Minh",[],[],[],[],[],18 m²,[],2 phòng,2 phòng,[],[],[],[],[],[],[],"['Nhà ngõ, hẻm']",[],[],[],[],[],[],[],[],[],"97,17 triệu/m²","1,749 tỷ- 18 m2đ"
1499,"Nhà Trần Khắc Chân, Tân Định, Q1 (3.5x10). 4.95 tỷ","Đường Trần Khắc Chân, Phường Tân Định, Quận 1, Tp Hồ Chí Minh",[],[],[],[],[],32 m²,60 m²,2 phòng,2 phòng,[],[],3.5 m,10 m,[],[],['Đã có sổ'],"['Nhà ngõ, hẻm']",[],[],[],[],[],[],[],[],[],"154,69 triệu/m²","4,95 tỷ- 32 m2đ"
1500,Bán nhà hẻm 3 gác cách mt 20m đường Hồ Hảo Hớn,"Đường Hồ Hảo Hớn, Phường Cô Giang, Quận 1, Tp Hồ Chí Minh",[],[],[],[],[],26 m²,51 m²,1 phòng,2 phòng,[],[],[],[],[],[],['Đã có sổ'],"['Nhà ngõ, hẻm']",[],[],[],[],[],[],[],[],[],"184,62 triệu/m²","4,8 tỷ- 26 m2đ"
1501,"Bán nhà 5tầng BTCT Nguyễn Trãi, Quận 1 giá 8 tỷ TL","Đường Nguyễn Trãi, Phường Nguyễn Cư Trinh, Quận 1, Tp Hồ Chí Minh",[],[],[],[],[],47 m²,[],7 phòng,[],7,[],[],[],[],[],['Đã có sổ'],"['Nhà ngõ, hẻm']",[],[],[],[],[],[],[],[],[],"170,21 triệu/m²",8 tỷ- 47 m2đ
1502,Bán nhà Biệt thự Quận 7,"1, Đường Nguyễn Văn Chiêm, Phường Đa Kao, Quận 1, Tp Hồ Chí Minh",[],[],[],[],[],493 m²,152.9 m²,nhiều hơn 10 phòng,Nhiều hơn 6 phòng,3,[],[],[],['Bắc'],[],['Đã có sổ'],['Nhà biệt thự'],[],[],[],[],[],[],[],['Hẻm xe hơi'],[],"83,16 triệu/m²",41 tỷ- 493 m2đ
1503,"Nhà Góc 2 Mặt TIền Mạc Đỉnh Chi, Phường Đakao, Q 1","Mạc Đỉnh Chi, Phường Đa Kao, Quận 1, Tp Hồ Chí Minh",[],[],[],[],[],30 m²,100 m²,5 phòng,5 phòng,3,[],5 m,10 m,[],[],['Đã có sổ'],"['Nhà mặt phố, mặt tiền']",[],[],[],[],[],[],[],[],[],"483,33 triệu/m²","14,5 tỷ- 30 m2đ"
1504,"Nhà MT Đinh Tiên Hoàng, Q1, 5.34 x17m,3 Tầng, 22tỷ","Đường Đinh Tiên Hoàng, Phường Đa Kao, Quận 1, Tp Hồ Chí Minh",[],[],[],[],[],74 m²,[],3 phòng,3 phòng,3,[],[],[],[],[],['Đã có sổ'],"['Nhà mặt phố, mặt tiền']",[],[],[],[],[],[],[],[],[],"297,3 triệu/m²",22 tỷ- 74 m2đ
1505,"Bán nhà Trần Hưng Đạo, Phường Cầu Kho, Quận 1","Đường Trần Hưng Đạo, Phường Cầu Kho, Quận 1, Tp Hồ Chí Minh",[],[],[],[],[],20 m²,100 m²,4 phòng,[],[],[],2.6 m,7.1 m,[],[],['Đã có sổ'],"['Nhà ngõ, hẻm']",[],[],[],[],[],[],[],[],[],225 triệu/m²,"4,5 tỷ- 20 m2đ"
1506,Nhà Trung Tâm P3-Q11-4x10/2L HXH-Lạc Long Quân🔥,"368, Kinh Dương Vương, Phường Bến Nghé, Quận 1, Tp Hồ Chí Minh",[],[],[],[],[],40 m²,110 m²,5 phòng,3 phòng,[],[],4 m,10 m,['Đông Bắc'],[],[],"['Nhà mặt phố, mặt tiền']",[],[],[],[],[],[],[],[],[],145 triệu/m²,"5,8 tỷ- 40 m2đ"
1507,"Bán nhà 101 Lê Thánh Tôn, Bến Nghé, Q1","Đường Lê Thánh Tôn, Phường Bến Nghé, Quận 1, Tp Hồ Chí Minh",[],[],[],[],[],68 m²,58 m²,1 phòng,1 phòng,[],[],4 m,20 m,[],[],['Đã có sổ'],"['Nhà mặt phố, mặt tiền']",[],[],[],[],[],[],[],[],[],"131,91 triệu/m²","8,97 tỷ- 68 m2đ"
1508,Bán nhà Q1 hẻm 2 xe hơi,"Đường Trần Hưng Đạo, Phường Cầu Kho, Quận 1, Tp Hồ Chí Minh",[],[],[],[],[],40 m²,151 m²,4 phòng,3 phòng,4,[],[],[],[],[],['Đã có sổ'],"['Nhà ngõ, hẻm']",[],[],[],[],['Hoàn thiện cơ bản'],[],[],['Hẻm xe hơi'],[],375 triệu/m²,15 tỷ- 40 m2đ
1509,"Chính chủ bán nhà Q.1, chưa qua đầu tư","Đường Nguyễn Cư Trinh, Phường Nguyễn Cư Trinh, Quận 1, Tp Hồ Chí Minh",[],[],[],[],[],30 m²,[],2 phòng,2 phòng,2,[],3 m,10 m,[],[],['Đã có sổ'],"['Nhà ngõ, hẻm']",[],[],[],[],[],[],[],[],[],90 triệu/m²,"2,7 tỷ- 30 m2đ"
1510,"Bán nhanh MT Trần Hưng Đạo Q.1, HĐT:140tr chỉ 36Ty","Đường Trần Hưng Đạo, Phường Cầu Kho, Quận 1, Tp Hồ Chí Minh",[],[],[],[],[],73 m²,372 m²,nhiều hơn 10 phòng,Nhiều hơn 6 phòng,8,[],4 m,18 m,['Tây Bắc'],[],['Đã có sổ'],"['Nhà mặt phố, mặt tiền']",[],[],[],[],['Nội thất cao cấp'],[],[],[],[],"493,15 triệu/m²",36 tỷ- 73 m2đ
1511,"Chủ thiện chí giảm sâu nhà MT Q1 CÒN 34,9 TỶ TL","Đường Nguyễn Văn Nguyễn, Phường Tân Định, Quận 1, Tp Hồ Chí Minh",[],[],[],[],[],89 m²,470 m²,nhiều hơn 10 phòng,Nhiều hơn 6 phòng,[],[],5.2 m,20 m,['Đông Bắc'],[],[],"['Nhà mặt phố, mặt tiền']",[],[],[],[],[],[],[],[],[],"392,13 triệu/m²","34,9 tỷ- 89 m2đ"
1512,Nhà Hẻm 6m Nguyễn Trãi Q1(4.5x19m) 1T3L HĐ 50tr/th,"Đường Nguyễn Trãi, Phường Nguyễn Cư Trinh, Quận 1, Tp Hồ Chí Minh",[],[],[],[],[],81 m²,[],8 phòng,[],[],[],4.5 m,19 m,[],[],['Đã có sổ'],"['Nhà ngõ, hẻm']",[],[],[],[],[],[],[],['Hẻm xe hơi'],[],"191,36 triệu/m²","15,5 tỷ- 81 m2đ"
1513,"Nhà Hẻm 6m, p.Phạm Ngũ Lão Q1.T3L. 6x12m.HĐ60tr/th","Đường Bùi Thị Xuân, Phường Phạm Ngũ Lão, Quận 1, Tp Hồ Chí Minh",[],[],[],[],[],70 m²,[],6 phòng,[],4,[],6 m,12 m,[],[],['Đã có sổ'],"['Nhà ngõ, hẻm']",[],[],[],[],[],[],[],['Hẻm xe hơi'],[],"207,14 triệu/m²","14,5 tỷ- 70 m2đ"
1514,"Mt trương hán siêu p.đakao q.1 dt:4,5x18m giá 17tỷ","Đường Trương Hán Siêu, Phường Đa Kao, Quận 1, Tp Hồ Chí Minh",[],[],[],[],[],78 m²,[],6 phòng,Nhiều hơn 6 phòng,[],[],4.5 m,18 m,[],[],['Đã có sổ'],"['Nhà mặt phố, mặt tiền']",[],[],[],[],[],[],[],['Nở hậu'],[],"228,21 triệu/m²","17,8 tỷ- 78 m2đ"
1515,"BÁN NHÀ NGUYỄN TRÃI QUẬN 1, NỞ HẬU, 25M2, GIÁ 4 TỶ","Đường Nguyễn Trãi, Phường Nguyễn Cư Trinh, Quận 1, Tp Hồ Chí Minh",[],[],[],[],[],25 m²,50 m²,2 phòng,2 phòng,2,[],3 m,7 m,[],[],['Đã có sổ'],"['Nhà ngõ, hẻm']",[],[],[],[],['Nội thất đầy đủ'],[],[],['Nở hậu'],[],160 triệu/m²,4 tỷ- 25 m2đ
1516,Nhà 1 trệt 2 lầu 80m2 hẻm 345 Trần Hưng Đạo Q1,"Trần Hưng Đạo, Phường Cầu Kho, Quận 1, Tp Hồ Chí Minh",[],[],[],[],[],27 m²,80 m²,3 phòng,3 phòng,[],[],3 m,9 m,[],[],['Đã có sổ'],"['Nhà ngõ, hẻm']",[],[],[],[],[],[],[],['Hẻm xe hơi'],[],"240,74 triệu/m²","6,5 tỷ- 27 m2đ"
1517,MT TRẦN HƯNG ĐẠO . PHƯỜNG NGUYỄN CƯ TRINH . QUẬN 1,"Đường Trần Hưng Đạo, Phường Nguyễn Cư Trinh, Quận 1, Tp Hồ Chí Minh",[],[],[],[],[],78 m²,[],6 phòng,Nhiều hơn 6 phòng,6,[],4 m,20 m,[],[],['Đã có sổ'],"['Nhà mặt phố, mặt tiền']",[],[],[],[],['Nội thất cao cấp'],[],[],"['Hẻm xe hơi', 'Nở hậu']",[],"282,05 triệu/m²",22 tỷ- 78 m2đ
1518,"Bán nhà chính chủ, hẻm xe hoi tới nhà","88/89, Nguyễn Van Quy, Phường Nguyễn Cư Trinh, Quận 1, Tp Hồ Chí Minh",[],[],[],[],[],81 m²,158 m²,3 phòng,4 phòng,[],[],4 m,20 m,['Tây Nam'],[],['Đã có sổ'],"['Nhà mặt phố, mặt tiền']",[],[],[],[],[],[],[],['Hẻm xe hơi'],[],"60,49 triệu/m²","4,9 tỷ- 81 m2đ"
1519,Cần mua nhà < 400 triệu,"Đường Lê Duẩn, Phường Bến Nghé, Quận 1, Tp Hồ Chí Minh",[],[],[],[],[],100 m²,100 m²,3 phòng,[],[],[],[],[],[],[],[],"['Nhà mặt phố, mặt tiền']",[],[],[],[],[],[],[],[],['Cần mua'],"4,5 triệu/m²",450 triệu- 100 m2đ
1520,Cần mua nhà < 1 ty,"Le Duan, Phường Bến Thành, Quận 1, Tp Hồ Chí Minh",[],[],[],[],[],100 m²,100 m²,3 phòng,[],[],[],[],[],[],[],[],"['Nhà mặt phố, mặt tiền']",[],[],[],[],[],[],[],[],['Cần mua'],10 triệu/m²,1 tỷ- 100 m2đ
1521,Chính chủ bán gấp mặt tiền Nguyễn Cảnh Chân,"Đường Nguyễn Cảnh Chân, Phường Nguyễn Cư Trinh, Quận 1, Tp Hồ Chí Minh",[],[],[],[],[],87 m²,547 m²,10 phòng,Nhiều hơn 6 phòng,7,[],5 m,18 m,['Nam'],[],['Đã có sổ'],"['Nhà mặt phố, mặt tiền']",[],[],[],[],[],[],[],['Hẻm xe hơi'],[],"488,51 triệu/m²","42,5 tỷ- 87 m2đ"
1522,MT Bùi Viện P.PNL Q1 DT:6.5x21m CN:130m 70 tỷ,"Đường Bùi Viện, Phường Phạm Ngũ Lão, Quận 1, Tp Hồ Chí Minh",[],[],[],[],[],130 m²,[],5 phòng,5 phòng,[],[],[],[],[],[],[],"['Nhà mặt phố, mặt tiền']",[],[],[],[],[],[],[],[],[],"538,46 triệu/m²",70 tỷ- 130 m2đ
1523,"Bán Nhà Trần Hưng Đạo q1. 1 trệt 1 lầuu, 2pn, 2wc.","135/, Đường Trần Hưng Đạo, Phường Cầu Ông Lãnh, Quận 1, Tp Hồ Chí Minh",[],[],[],[],[],63 m²,[],2 phòng,2 phòng,1,[],4.5 m,14 m,[],[],['Đã có sổ'],"['Nhà ngõ, hẻm']",[],[],[],[],[],[],[],[],[],"29,37 triệu/m²","1,85 tỷ- 63 m2đ"
1524,"Nhà 1 trệt 1 lầu 48m2 đường cô bắc, p.cô giang, Q1","171/, Đường Cô Bắc, Phường Cô Giang, Quận 1, Tp Hồ Chí Minh",[],[],[],[],[],48 m²,[],2 phòng,2 phòng,1,[],4 m,12 m,[],[],['Đã có sổ'],"['Nhà ngõ, hẻm']",[],[],[],[],['Nội thất đầy đủ'],[],[],[],[],"38,54 triệu/m²","1,85 tỷ- 48 m2đ"
1525,MT Lê Lai P.BT Q1 CN 91m 2L HDT 80tr giá 33 tỷ,"Đường Lê Lai, Phường Bến Thành, Quận 1, Tp Hồ Chí Minh",[],[],[],[],[],91 m²,[],4 phòng,6 phòng,[],[],[],[],[],[],[],"['Nhà mặt phố, mặt tiền']",[],[],[],[],[],[],[],[],[],"362,64 triệu/m²",33 tỷ- 91 m2đ
1526,"Nhà 4 tầng dt 41m2 hẻm 102 Trần Quang Khải, Quận 1","Đường Trần Quang Khải, Phường Tân Định, Quận 1, Tp Hồ Chí Minh",[],[],[],[],[],41 m²,[],3 phòng,3 phòng,4,[],7.2 m,6.3 m,['Đông'],[],['Đã có sổ'],"['Nhà ngõ, hẻm']",[],[],[],[],['Nội thất cao cấp'],[],[],[],[],"130,49 triệu/m²","5,35 tỷ- 41 m2đ"
1527,"Bán nhà Lê Thánh Tôn, Bến Thành, Quận 1, TPHCM","Đường Lê Thánh Tôn, Phường Bến Thành, Quận 1, Tp Hồ Chí Minh",[],[],[],[],[],150 m²,[],3 phòng,3 phòng,[],[],5 m,30 m,[],[],[],"['Nhà mặt phố, mặt tiền']",[],[],[],[],[],[],[],[],[],100 triệu/m²,15 tỷ- 150 m2đ
1528,Mặt tiền Trần Hưng Đạo gía rẻ bán gấp!.,"Đường Trần Hưng Đạo, Phường Cầu Kho, Quận 1, Tp Hồ Chí Minh",[],[],[],[],[],72 m²,150 m²,6 phòng,4 phòng,2,[],4 m,18 m,[],[],['Đã có sổ'],"['Nhà mặt phố, mặt tiền']",[],[],[],[],[],[],[],['Nở hậu'],[],"458,33 triệu/m²",33 tỷ- 72 m2đ
1529,Mặt Tiền 1761 Hai Bà Trưng 95m2 4 Tầng,"=> Gọi 0833083123 & 0902187404, Xem Nhà $ Hiền 4 Nguyễn 608 Thượng 42/44B Kiệm Xu 13 Đình 1277B Trần 136/24 Lê Đức Thọ, Phường Bến Thành, Quận 1, Tp Hồ Chí Minh",[],[],[],[],[],7654 m²,[],nhiều hơn 10 phòng,[],[],[],[],[],[],[],[],"['Nhà mặt phố, mặt tiền']",[],[],[],[],[],[],[],[],['Cần mua'],"2,51 triệu/m²","19,2 tỷ- 7.654 m2đ"
1530,Nhà HXH 8m 1215 Lê Thánh Tôn 326M2 4 Tầng,"=> Gọi 0833083123 & 0902187404, Xem Nhà $ Hiền 4 Nguyễn 608 Thượng 42/44B Kiệm Xu 13 Đình 1277B Trần 136/24 Lê Đức Thọ, Phường Bến Thành, Quận 1, Tp Hồ Chí Minh",[],[],[],[],[],7654 m²,[],nhiều hơn 10 phòng,[],[],[],[],[],[],[],[],"['Nhà mặt phố, mặt tiền']",[],[],[],[],[],[],[],[],['Cần mua'],3 triệu/m²,23 tỷ- 7.654 m2đ
1531,CHDV 1363 Nguyễn Tất Thành 3500M2 10 TẦNG,"=> Gọi 0833083123 & 0902187404, Xem Nhà $ Hiền 4 Nguyễn 608 Thượng 42/44B Kiệm Xu 13 Đình 1277B Trần 136/24 Lê Đức Thọ, Phường Bến Thành, Quận 1, Tp Hồ Chí Minh",[],[],[],[],[],7654 m²,[],nhiều hơn 10 phòng,[],[],[],[],[],[],[],[],"['Nhà mặt phố, mặt tiền']",[],[],[],[],[],[],[],[],['Cần mua'],"5,23 triệu/m²",40 tỷ- 7.654 m2đ
1532,Nhà HXH 8m 1726 Trần Hưng Đạo 520M2 6 Tầng,"=> Gọi 0833083123 & 0902187404, Xem Nhà $ Hiền 4 Nguyễn 608 Thượng 42/44B Kiệm Xu 13 Đình 1277B Trần 136/24 Lê Đức Thọ, Phường Bến Thành, Quận 1, Tp Hồ Chí Minh",[],[],[],[],[],87654 m²,[],nhiều hơn 10 phòng,[],[],[],[],[],[],[],[],"['Nhà mặt phố, mặt tiền']",[],[],[],[],[],[],[],[],['Cần mua'],188.240 đ/m²,"16,5 tỷ- 87.654 m2đ"
1533,"Nhà mặt tiền 1 trệt 3 lầu 80m2 Tân Định, Quận 1","10 A, TRẦN NHẬT DUẬT, Phường Tân Định, Quận 1, Tp Hồ Chí Minh",[],[],[],[],[],80 m²,80 m²,5 phòng,5 phòng,[],[],5 m,16 m,[],[],['Đã có sổ'],"['Nhà mặt phố, mặt tiền']",[],[],[],[],[],[],[],[],[],400 triệu/m²,32 tỷ- 80 m2đ
1534,Nhà đầu hẻm Bùi viện 2PN 1VS,Đường Bùi Viện,[],[],[],[],[],21 m²,21 m²,2 phòng,1 phòng,[],[],3 m,7 m,[],[],['Đã có sổ'],"['Nhà ngõ, hẻm']",[],[],[],[],['Nội thất đầy đủ'],[],[],[],[],"333,33 triệu/m²",7 tỷ- 21 m2đ
1535,Cần bán nhà ở Quận 1. Giá chuẩn,"6/2bis, Đường Đề Thám, Phường Cầu Ông Lãnh, Quận 1, Tp Hồ Chí Minh",[],[],[],[],[],10 m²,10 m²,1 phòng,1 phòng,[],[],2 m,5 m,[],[],[],"['Nhà ngõ, hẻm']",[],[],[],[],[],[],[],[],[],260 triệu/m²,"2,6 tỷ- 10 m2đ"
1536,"Nhà phố hẻm 3m Hoàng Sa-Ng Văn Nguyễn, Tân Định Q1","Đường Hoàng Sa, Phường Tân Định, Quận 1, Tp Hồ Chí Minh",[],[],[],[],[],30 m²,[],3 phòng,3 phòng,3,[],[],[],[],[],['Đã có sổ'],"['Nhà ngõ, hẻm']",[],[],[],[],[],[],[],[],[],"126,67 triệu/m²","3,8 tỷ- 30 m2đ"
1537,Bán gấp nhà Bùi Viện quận 1 có sẵn 2PN giá 900tr,"Đường Bùi Viện, Phường Phạm Ngũ Lão, Quận 1, Tp Hồ Chí Minh",[],[],[],[],[],10 m²,30 m²,2 phòng,2 phòng,[],[],33 m,33 m,[],[],['Đã có sổ'],"['Nhà ngõ, hẻm']",[],[],[],[],[],[],[],['Nở hậu'],[],90 triệu/m²,900 triệu- 10 m2đ
1538,"Bán nhà mặt tiền trần đình xu 4,2x20/5lầu","Trần Đình Xu, Phường Cầu Kho, Quận 1, Tp Hồ Chí Minh",[],[],[],[],[],73 m²,400 m²,6 phòng,6 phòng,5,[],[],[],[],[],['Đã có sổ'],"['Nhà mặt phố, mặt tiền']",[],[],[],[],[],[],[],[],[],"356,16 triệu/m²",26 tỷ- 73 m2đ
1539,"Bán nhà chính chủ, hẻm xe hoi tới nhà","88/89, Nguyễn Van Quy, Phường Nguyễn Cư Trinh, Quận 1, Tp Hồ Chí Minh",[],[],[],[],[],81 m²,158 m²,3 phòng,4 phòng,[],[],4 m,20 m,['Tây Nam'],[],['Đã có sổ'],"['Nhà mặt phố, mặt tiền']",[],[],[],[],[],[],[],['Hẻm xe hơi'],[],"60,49 triệu/m²","4,9 tỷ- 81 m2đ"
1540,MT TRẦN HƯNG ĐẠO . PHƯỜNG NGUYỄN CƯ TRINH . QUẬN 1,"Đường Trần Hưng Đạo, Phường Nguyễn Cư Trinh, Quận 1, Tp Hồ Chí Minh",[],[],[],[],[],78 m²,[],6 phòng,Nhiều hơn 6 phòng,6,[],4 m,20 m,[],[],['Đã có sổ'],"['Nhà mặt phố, mặt tiền']",[],[],[],[],['Nội thất cao cấp'],[],[],"['Hẻm xe hơi', 'Nở hậu']",[],"282,05 triệu/m²",22 tỷ- 78 m2đ
1541,Nhà nhỏ siêu xinh trung tâm quận 1,"Đường Nguyễn Trãi, Phường Nguyễn Cư Trinh, Quận 1, Tp Hồ Chí Minh",[],[],[],[],[],36 m²,32 m²,2 phòng,3 phòng,[],[],6 m,6 m,[],[],['Đã có sổ'],"['Nhà ngõ, hẻm']",[],[],[],[],['Nội thất cao cấp'],[],[],[],[],"201,39 triệu/m²","7,25 tỷ- 36 m2đ"
1542,"NHÀ TRẦN QUANG KHẢI, Q1, HXH, 56M2, SỔ HỒNG RIÊNG","Đường Trần Quang Khải, Phường Tân Định, Quận 1, Tp Hồ Chí Minh",[],[],[],[],[],56 m²,[],2 phòng,2 phòng,1,[],5 m,11.2 m,[],[],['Đã có sổ'],"['Nhà ngõ, hẻm']",[],[],[],[],['Nội thất đầy đủ'],[],[],"['Hẻm xe hơi', 'Nở hậu']",[],"22,43 triệu/m²","1,256 tỷ- 56 m2đ"
1543,RA ĐI NHANH GỌN NHÀ ĐIỆN BIÊN PHỦ 59M2 SỞ HỮU 3PN,"Đường Điện Biên Phủ, Phường Đa Kao, Quận 1, Tp Hồ Chí Minh",[],[],[],[],[],59 m²,[],3 phòng,2 phòng,1,[],[],[],[],[],['Đã có sổ'],"['Nhà ngõ, hẻm']",[],[],[],[],['Nội thất đầy đủ'],[],[],['Hẻm xe hơi'],[],"42,86 triệu/m²","2,529 tỷ- 59 m2đ"
1544,CẦN TIỀN CHỮA BỆNH NÊN BÁN GẤP NHÀ TRẦN ĐÌNH XU Q1,"Đường Trần Đình Xu, Phường Nguyễn Cư Trinh, Quận 1, Tp Hồ Chí Minh",[],[],[],[],[],54 m²,108 m²,2 phòng,2 phòng,[],[],4 m,13 m,[],[],['Đã có sổ'],"['Nhà ngõ, hẻm']",[],[],[],[],[],[],[],"['Hẻm xe hơi', 'Nở hậu']",[],"27,04 triệu/m²","1,46 tỷ- 54 m2đ"
1545,"CHỈ 1,48 TỶ ĐÃ CÓ NGAY NHÀ Đ. SƯƠNG NGUYỆT ÁNH Q1","Đường Sương Nguyệt Ánh, Phường Bến Thành, Quận 1, Tp Hồ Chí Minh",[],[],[],[],[],46 m²,[],2 phòng,3 phòng,[],[],[],[],[],[],['Đã có sổ'],"['Nhà ngõ, hẻm']",[],[],[],[],[],[],[],"['Hẻm xe hơi', 'Nở hậu']",[],"32,17 triệu/m²","1,48 tỷ- 46 m2đ"
1546,"BÁN GẤP NHÀ ĐẶNG DUNG Q1, GIÁ TỐT 1 TỶ 250TR, SHR","Đường Đặng Dung, Phường Tân Định, Quận 1, Tp Hồ Chí Minh",[],[],[],[],[],54 m²,54 m²,2 phòng,2 phòng,1,[],5 m,10 m,[],[],['Đã có sổ'],"['Nhà ngõ, hẻm']",[],[],[],[],['Hoàn thiện cơ bản'],[],[],['Hẻm xe hơi'],[],"23,15 triệu/m²","1,25 tỷ- 54 m2đ"
