,title,address,project_name,apartment_code,block_name,block_code,square,square_area,square_in_use,bedroom,wc,num_floor,floor,width,height,door,balcony,certificates,house_type,estate_type,office_type,apartment_type,status,furniture_status,estate_status,apartment_specific,house_specific,_type,price_m2,price_square
1029,"ĐẦU TƯ,Quận 1,nhà Trần Khánh Dư,50m2 nhỉnh 4 tỷ","Đường Trần Khánh Dư, Phường Tân Định, Quận 1, Tp Hồ Chí Minh",[],[],[],[],[],50 m²,[],3 phòng,[],[],[],[],[],[],[],['Đã có sổ'],"['Nhà ngõ, hẻm']",[],[],[],[],[],[],[],[],[],86 triệu/m²,"4,3 tỷ- 50 m2đ"
1030,"Cao ốc mt Nguyễn Đình Chiểu và Mạc Đỉnh Chi,9 Tầng","31, Đường Nguyễn Đình Chiểu, Phường Đa Kao, Quận 1, Tp Hồ Chí Minh",[],[],[],[],[],228 m²,1083 m²,nhiều hơn 10 phòng,Nhiều hơn 6 phòng,[],[],17 m,14 m,['Đông Bắc'],[],[],"['Nhà mặt phố, mặt tiền']",[],[],[],[],[],[],[],[],[],"921,05 triệu/m²",210 tỷ- 228 m2đ
1031,NHÀ GÓC 2 MẶT TIỀN HẺM XE HƠI TRẦN QUANG KHẢI Q.1,"Đường Trần Quang Khải, Phường Tân Định, Quận 1, Tp Hồ Chí Minh",[],[],[],[],[],33 m²,100 m²,4 phòng,3 phòng,[],[],3.5 m,9 m,[],[],['Đã có sổ'],"['Nhà ngõ, hẻm']",[],[],[],[],[],[],[],"['Hẻm xe hơi', 'Nở hậu']",[],"175,76 triệu/m²","5,8 tỷ- 33 m2đ"
1032,Nhà trệt lầu Nguyễn phi khanh q1,"Đường Nguyễn Phi Khanh, Phường Tân Định, Quận 1, Tp Hồ Chí Minh",[],[],[],[],[],22 m²,31 m²,2 phòng,2 phòng,2,[],3 m,8 m,[],[],['Đã có sổ'],"['Nhà ngõ, hẻm']",[],[],[],[],[],[],[],[],[],125 triệu/m²,"2,75 tỷ- 22 m2đ"
1033,MT TRẦN HƯNG ĐẠO . PHƯỜNG NGUYỄN CƯ TRINH . QUẬN 1,"Đường Trần Hưng Đạo, Phường Nguyễn Cư Trinh, Quận 1, Tp Hồ Chí Minh",[],[],[],[],[],78 m²,[],6 phòng,Nhiều hơn 6 phòng,6,[],4 m,20 m,[],[],['Đã có sổ'],"['Nhà mặt phố, mặt tiền']",[],[],[],[],['Nội thất cao cấp'],[],[],"['Hẻm xe hơi', 'Nở hậu']",[],"282,05 triệu/m²",22 tỷ- 78 m2đ
1034,"Bán nhà chính chủ, hẻm xe hoi tới nhà","88/89, Nguyễn Van Quy, Phường Nguyễn Cư Trinh, Quận 1, Tp Hồ Chí Minh",[],[],[],[],[],81 m²,158 m²,3 phòng,4 phòng,[],[],4 m,20 m,['Tây Nam'],[],['Đã có sổ'],"['Nhà mặt phố, mặt tiền']",[],[],[],[],[],[],[],['Hẻm xe hơi'],[],"60,49 triệu/m²","4,9 tỷ- 81 m2đ"
1035,BÁN GẤP NHÀ 10 PHONG NGAY Q1,"212/, Đường Nguyễn Trãi, Phường Nguyễn Cư Trinh, Quận 1, Tp Hồ Chí Minh",[],[],[],[],[],40 m²,210 m²,9 phòng,6 phòng,[],[],4 m,12 m,['Đông Nam'],[],[],"['Nhà ngõ, hẻm']",[],[],[],[],[],[],[],[],[],310.000 đ/m²,"12,4 triệu- 40 m2đ"
1036,"Nhà 50m2 Trần Khánh Dư Quận 1, TL hẻm ô tô siêu rẻ","Đường Trần Khánh Dư, Phường Tân Định, Quận 1, Tp Hồ Chí Minh",[],[],[],[],[],50 m²,100 m²,2 phòng,3 phòng,2,[],3.5 m,15 m,[],[],['Đã có sổ'],"['Nhà ngõ, hẻm']",[],[],[],[],['Bàn giao thô'],[],[],"['Hẻm xe hơi', 'Nở hậu']",[],"85,8 triệu/m²","4,29 tỷ- 50 m2đ"
1037,Bán nhà đang cho thuê 1ty/năm,"Đường Cống Quỳnh, Phường Phạm Ngũ Lão, Quận 1, Tp Hồ Chí Minh",[],[],[],[],[],135 m²,600 m²,nhiều hơn 10 phòng,Nhiều hơn 6 phòng,5,[],4 m,40 m,['Nam'],[],['Đã có sổ'],"['Nhà ngõ, hẻm']",[],[],[],[],['Nội thất cao cấp'],[],[],['Hẻm xe hơi'],[],"133,33 triệu/m²",18 tỷ- 135 m2đ
1038,Bán nhà hẻm Bùi Thị Xuân Q.1 DT:3.65X 15.5 3 Lầu,"Đường Bùi Thị Xuân, Phường Phạm Ngũ Lão, Quận 1, Tp Hồ Chí Minh",[],[],[],[],[],58 m²,[],4 phòng,Nhiều hơn 6 phòng,[],[],3 m,15 m,[],[],['Đã có sổ'],"['Nhà ngõ, hẻm']",[],[],[],[],['Nội thất cao cấp'],[],[],['Nở hậu'],[],"187,93 triệu/m²","10,9 tỷ- 58 m2đ"
1039,"Bán nhà hẻm Đinh Tiên Hoàng q1, 72m2 5L thuê 80tr","Đường Đinh Tiên Hoàng, Phường Đa Kao, Quận 1, Tp Hồ Chí Minh",[],[],[],[],[],72 m²,70 m²,nhiều hơn 10 phòng,[],[],[],55 m,15 m,[],[],['Đã có sổ'],"['Nhà ngõ, hẻm']",[],[],[],[],[],[],[],['Hẻm xe hơi'],[],"262,5 triệu/m²","18,9 tỷ- 72 m2đ"
1040,"Bán nhà Trần Hưng Đạo,Q1, 3.2x7.9, 1tr 3L 1st, 3pn","Đường Trần Hưng Đạo, Phường Cầu Kho, Quận 1, Tp Hồ Chí Minh",[],[],[],[],[],25 m²,125 m²,3 phòng,4 phòng,5,[],3.2 m,7.9 m,[],[],['Đã có sổ'],"['Nhà ngõ, hẻm']",[],[],[],[],[],[],[],[],[],198 triệu/m²,"4,95 tỷ- 25 m2đ"
1041,"Bán nhà 214/B14B, Nguyễn Trãi, Quận 1","214/B14B, Đường Nguyễn Trãi, Phường Nguyễn Cư Trinh, Quận 1, Tp Hồ Chí Minh",[],[],[],[],[],42 m²,200 m²,10 phòng,Nhiều hơn 6 phòng,6,[],4.2 m,10 m,[],[],['Đã có sổ'],"['Nhà mặt phố, mặt tiền']",[],[],[],[],['Nội thất cao cấp'],[],[],['Nở hậu'],[],"292,86 triệu/m²","12,3 tỷ- 42 m2đ"
1042,"BÁN NHÀ Q1, 16 Huyền Quang, P Tân Định, TP HCM","16 Huyền Quang, Phường Tân Định, Quận 1, Tp Hồ Chí Minh",[],[],[],[],[],60 m²,260 m²,8 phòng,Nhiều hơn 6 phòng,[],[],4 m,17 m,[],[],['Đã có sổ'],"['Nhà mặt phố, mặt tiền']",[],[],[],[],[],[],[],[],[],300 triệu/m²,18 tỷ- 60 m2đ
1043,"Hẻm 353/ Phạm Ngũ Lão Q1,DT: 3,8x15,2m ,trệt 2 lầu","353/, Đường Phạm Ngũ Lão, Phường Phạm Ngũ Lão, Quận 1, Tp Hồ Chí Minh",[],[],[],[],[],50 m²,[],4 phòng,3 phòng,3,[],3.8 m,15.2 m,[],[],['Đã có sổ'],"['Nhà ngõ, hẻm']",[],[],[],[],[],[],[],[],[],210 triệu/m²,"10,5 tỷ- 50 m2đ"
1044,"QUÁ HIẾM 391Trần Hưng Đạo, Quận 1, 30m chỉ 4,95tỷ.","Đường Trần Hưng Đạo, Phường Cầu Kho, Quận 1, Tp Hồ Chí Minh",[],[],[],[],[],30 m²,[],3 phòng,5 phòng,[],[],[],[],[],[],['Đã có sổ'],"['Nhà ngõ, hẻm']",[],[],[],[],[],[],[],[],[],165 triệu/m²,"4,95 tỷ- 30 m2đ"
1045,QUẬN 1 - TRẦN KHẮC CHÂN - DT 50M2 - 4.3 Tỷ,"Đường Trần Khắc Chân, Phường Tân Định, Quận 1, Tp Hồ Chí Minh",[],[],[],[],[],50 m²,100 m²,2 phòng,3 phòng,[],[],3.5 m,15 m,[],[],['Đã có sổ'],"['Nhà ngõ, hẻm']",[],[],[],[],['Nội thất đầy đủ'],[],[],['Nở hậu'],[],86 triệu/m²,"4,3 tỷ- 50 m2đ"
1046,"CHÍNH CHỦ🆘NHÀ QUẬN 1, 4 TẦNG; 2,6 TỶthuê 15 triệu",Đường Nguyễn Văn Cừ,[],[],[],[],[],21 m²,104 m²,5 phòng,2 phòng,[],[],3 m,7 m,['Đông Nam'],[],[],"['Nhà ngõ, hẻm']",[],[],[],[],[],[],[],[],[],"123,81 triệu/m²","2,6 tỷ- 21 m2đ"
1047,"Nhà hẻm quận 1 phường Đa Kao , 1 lầu mới","Đường Xô Viết Nghệ Tĩnh, Phường Đa Kao, Quận 1, Tp Hồ Chí Minh",[],[],[],[],[],10 m²,[],1 phòng,1 phòng,[],[],[],[],[],[],['Đã có sổ'],"['Nhà ngõ, hẻm']",[],[],[],[],[],[],[],[],[],119 triệu/m²,"1,19 tỷ- 10 m2đ"
1048,"Nhà KD CHDV 5 Phòng Trần Khắc Chân Q1 ,5 tầng 7,7t","Đường Trần Khắc Chân, Phường Tân Định, Quận 1, Tp Hồ Chí Minh",[],[],[],[],[],38 m²,180 m²,5 phòng,5 phòng,5,[],4 m,10 m,[],[],['Đã có sổ'],"['Nhà ngõ, hẻm']",[],[],[],[],['Nội thất cao cấp'],[],[],['Hẻm xe hơi'],[],"197,37 triệu/m²","7,5 tỷ- 38 m2đ"
1049,Nhà H Đông Nam Q1 gần Chợ Tân Định giảm giá 4 tỷ,"đinh công tráng, Phường Đa Kao, Quận 1, Tp Hồ Chí Minh",[],[],[],[],[],60 m²,[],4 phòng,4 phòng,[],[],4 m,15 m,[],[],[],"['Nhà mặt phố, mặt tiền']",[],[],[],[],[],[],[],[],[],"316,67 triệu/m²",19 tỷ- 60 m2đ
1050,"Nhà 1 Trệt, 3 Lầu, 33m2 đường Nguyễn Hữu Cầu.","Đường Nguyễn Hữu Cầu, Phường Tân Định, Quận 1, Tp Hồ Chí Minh",[],[],[],[],[],33 m²,[],3 phòng,4 phòng,3,[],3 m,11 m,[],[],['Đã có sổ'],"['Nhà ngõ, hẻm']",[],[],[],[],[],[],[],['Hẻm xe hơi'],[],"166,67 triệu/m²","5,5 tỷ- 33 m2đ"
1051,Nhà chợ Tân Định 1 Trệt 4 Lầu DT 4×17,"Đường Huyền Quang, Phường Tân Định, Quận 1, Tp Hồ Chí Minh",[],[],[],[],[],68 m²,[],8 phòng,Nhiều hơn 6 phòng,4,[],4 m,17 m,[],[],['Đã có sổ'],"['Nhà mặt phố, mặt tiền']",[],[],[],[],[],[],[],[],[],"264,71 triệu/m²",18 tỷ- 68 m2đ
1052,BÁN NHÀ ĐƯỜNG MẠC ĐỈNH CHI PHƯỜNG ĐA KAO QUẬN 1,"Đường Mạc Đĩnh Chi, Phường Đa Kao, Quận 1, Tp Hồ Chí Minh",[],[],[],[],[],60 m²,180 m²,4 phòng,5 phòng,3,[],4 m,15 m,[],[],['Đã có sổ'],"['Nhà mặt phố, mặt tiền']",[],[],[],[],[],[],[],[],[],"68,33 triệu/m²","4,1 tỷ- 60 m2đ"
1053,Bán Nhà 1 Trệt 2 Lầu Hẻm Phạm Ngũ Lão Q1,"Đường Phạm Ngũ Lão, Phường Phạm Ngũ Lão, Quận 1, Tp Hồ Chí Minh",[],[],[],[],[],55.1 m²,[],4 phòng,3 phòng,[],[],3.8 m,14.5 m,[],[],[],"['Nhà ngõ, hẻm']",[],[],[],[],[],[],[],[],[],"327,27 triệu/m²",18 tỷ- 55.1 m2đ
1054,Ngay mặt tiền Hoàng Sa 46m2 2 lầu giá 4.7 tỷ,"Đường Hoàng Sa, Phường Tân Định, Quận 1, Tp Hồ Chí Minh",[],[],[],[],[],46 m²,90 m²,1 phòng,1 phòng,[],[],3 m,10 m,[],[],['Đã có sổ'],"['Nhà ngõ, hẻm']",[],[],[],[],[],[],[],"['Hẻm xe hơi', 'Nở hậu']",[],"102,17 triệu/m²","4,7 tỷ- 46 m2đ"
1055,"Bán nhà chính chủ, hẻm xe hoi tới nhà","88/89, Nguyễn Van Quy, Phường Nguyễn Cư Trinh, Quận 1, Tp Hồ Chí Minh",[],[],[],[],[],81 m²,158 m²,3 phòng,4 phòng,[],[],4 m,20 m,['Tây Nam'],[],['Đã có sổ'],"['Nhà mặt phố, mặt tiền']",[],[],[],[],[],[],[],['Hẻm xe hơi'],[],"60,49 triệu/m²","4,9 tỷ- 81 m2đ"
1056,MT TRẦN HƯNG ĐẠO . PHƯỜNG NGUYỄN CƯ TRINH . QUẬN 1,"Đường Trần Hưng Đạo, Phường Nguyễn Cư Trinh, Quận 1, Tp Hồ Chí Minh",[],[],[],[],[],78 m²,[],6 phòng,Nhiều hơn 6 phòng,6,[],4 m,20 m,[],[],['Đã có sổ'],"['Nhà mặt phố, mặt tiền']",[],[],[],[],['Nội thất cao cấp'],[],[],"['Hẻm xe hơi', 'Nở hậu']",[],"282,05 triệu/m²",22 tỷ- 78 m2đ
1057,Bán nhà 24 trương hán siêu dakao Q1 giá 17.5 tỷ,"24, trương hán siêu, Phường Đa Kao, Quận 1, Tp Hồ Chí Minh",[],[],[],[],[],78 m²,[],4 phòng,4 phòng,3,[],4.5 m,17 m,[],[],['Đã có sổ'],"['Nhà mặt phố, mặt tiền']",[],[],[],[],[],[],[],[],[],"224,36 triệu/m²","17,5 tỷ- 78 m2đ"
1058,Bán gấp mặt tiền khu Trần Quang Khải Q1.,"Đường Trần Quang Khải, Phường Tân Định, Quận 1, Tp Hồ Chí Minh",[],[],[],[],[],150 m²,500 m²,6 phòng,6 phòng,4,[],7 m,23 m,[],[],['Đã có sổ'],"['Nhà mặt phố, mặt tiền']",[],[],[],[],[],[],[],['Nở hậu'],[],320 triệu/m²,48 tỷ- 150 m2đ
1059,"Nhà MT đường Nguyễn Trãi, Q.1, DT: 2.8x10m, 11 tỷ","Đường Nguyễn Trãi, Phường Nguyễn Cư Trinh, Quận 1, Tp Hồ Chí Minh",[],[],[],[],[],28 m²,[],3 phòng,3 phòng,[],[],2.8 m,10 m,[],[],['Đã có sổ'],"['Nhà mặt phố, mặt tiền']",[],[],[],[],[],[],[],[],[],"392,86 triệu/m²",11 tỷ- 28 m2đ
1060,"Bán nhà THĐ quận 1, HXH, dt 3x9, 3Tang, 3PN, 3WC","Đường Trần Hưng Đạo, Phường Cầu Kho, Quận 1, Tp Hồ Chí Minh",[],[],[],[],[],26.5 m²,79.5 m²,2 phòng,3 phòng,3,[],3 m,8.8 m,[],[],['Đã có sổ'],"['Nhà ngõ, hẻm']",[],[],[],[],[],[],[],['Hẻm xe hơi'],[],"211,54 triệu/m²","5,5 tỷ- 26.5 m2đ"
1061,Nhà phố đẹp Bùi Thị Xuân Q1 Giá : 10.7 tỷ,"Đường Bùi Thị Xuân, Phường Bến Thành, Quận 1, Tp Hồ Chí Minh",[],[],[],[],[],52 m²,[],3 phòng,3 phòng,[],[],[],[],[],[],['Đã có sổ'],"['Nhà mặt phố, mặt tiền']",[],[],[],[],[],[],[],[],[],"205,77 triệu/m²","10,7 tỷ- 52 m2đ"
1062,bán nhà quận 1 nguyễn cảnh chân,"nguyễn cảnh chân, Phường Cầu Kho, Quận 1, Tp Hồ Chí Minh",[],[],[],[],[],35 m²,100 m²,5 phòng,4 phòng,[],[],3 m,11 m,[],[],['Đã có sổ'],"['Nhà ngõ, hẻm']",[],[],[],[],[],[],[],[],[],"205,71 triệu/m²","7,2 tỷ- 35 m2đ"
1063,Nhà Tân Định 30m2,"Đường Đặng Dung, Phường Tân Định, Quận 1, Tp Hồ Chí Minh",[],[],[],[],[],30 m²,[],2 phòng,[],[],[],4.5 m,6.7 m,[],[],[],"['Nhà ngõ, hẻm']",[],[],[],[],[],[],[],[],[],65 triệu/m²,"1,95 tỷ- 30 m2đ"
1064,"Bán nhà MT P đakao, Q.1 ngang 5.3m, giá siêu rẻ","Đường Đinh Tiên Hoàng, Phường Đa Kao, Quận 1, Tp Hồ Chí Minh",[],[],[],[],[],96 m²,[],6 phòng,6 phòng,[],[],5 m,18 m,[],[],['Đã có sổ'],"['Nhà mặt phố, mặt tiền']",[],[],[],[],[],[],[],[],[],"223,96 triệu/m²","21,5 tỷ- 96 m2đ"
1065,Bán Nhà Đẹp Mặt Tiền Nguyễn Cảnh Chân Quận 1,"Đường Nguyễn Cảnh Chân, Phường Nguyễn Cư Trinh, Quận 1, Tp Hồ Chí Minh",[],[],[],[],[],96 m²,96 m²,nhiều hơn 10 phòng,Nhiều hơn 6 phòng,[],[],5 m,19 m,['Tây Nam'],[],['Đã có sổ'],"['Nhà mặt phố, mặt tiền']",[],[],[],[],['Nội thất đầy đủ'],[],[],['Hẻm xe hơi'],[],"468,75 triệu/m²",45 tỷ- 96 m2đ
1066,"Nhà trung tâm quận 1 có sổ hồng riêng - 63,95m2","104, Nguyễn Trãi, Phường Nguyễn Cư Trinh, Quận 1, Tp Hồ Chí Minh",[],[],[],[],[],63 m²,63 m²,2 phòng,2 phòng,[],[],7 m,9 m,['Đông Nam'],[],['Đã có sổ'],"['Nhà ngõ, hẻm']",[],[],[],[],['Nội thất đầy đủ'],[],[],"['Hẻm xe hơi', 'Nở hậu']",[],50 triệu/m²,"3,15 tỷ- 63 m2đ"
1067,"Nhà Quận 1, Thái Văn Lung, 4x24m, 3 tầng","Đường Thái Văn Lung, Phường Bến Nghé, Quận 1, Tp Hồ Chí Minh",[],[],[],[],[],96 m²,250 m²,4 phòng,4 phòng,4,[],4 m,24 m,[],[],['Đã có sổ'],"['Nhà mặt phố, mặt tiền']",[],[],[],[],['Nội thất đầy đủ'],[],[],[],[],"729,17 triệu/m²",70 tỷ- 96 m2đ
1068,"Nhà hẻm an ninh Calmette quan 1, 62m2, cần tìm chủ","Đường Calmette, Phường Nguyễn Thái Bình, Quận 1, Tp Hồ Chí Minh",[],[],[],[],[],62.1 m²,[],3 phòng,3 phòng,4,[],7 m,9 m,['Đông Bắc'],[],['Đã có sổ'],"['Nhà ngõ, hẻm']",[],[],[],[],[],[],[],[],[],"161,29 triệu/m²",10 tỷ- 62.1 m2đ
1069,Bán nhà nhỏ giá rẻ quận 1,"Đường Cô Bắc, Phường Cô Giang, Quận 1, Tp Hồ Chí Minh",[],[],[],[],[],24 m²,48 m²,2 phòng,2 phòng,[],[],4 m,6 m,['Đông'],[],['Đã có sổ'],"['Nhà ngõ, hẻm']",[],[],[],[],[],[],[],[],[],"166,67 triệu/m²",4 tỷ- 24 m2đ
1070,Bán nhà quận 1 giá gò vấp nguyễn văn nguyễn,"Đường Nguyễn Văn Nguyễn, Phường Tân Định, Quận 1, Tp Hồ Chí Minh",[],[],[],[],[],30 m²,30 m²,3 phòng,3 phòng,2,[],3 m,9 m,['Đông Bắc'],[],['Đã có sổ'],"['Nhà ngõ, hẻm']",[],[],[],[],['Hoàn thiện cơ bản'],[],[],[],[],130 triệu/m²,"3,9 tỷ- 30 m2đ"
1071,Hẻm 4M Hoàng Sa . DT 4x9 5 tầng,"197/, Đường Hoàng Sa, Phường Tân Định, Quận 1, Tp Hồ Chí Minh",[],[],[],[],[],36 m²,114 m²,3 phòng,4 phòng,[],[],4 m,9 m,[],[],['Đã có sổ'],"['Nhà ngõ, hẻm']",[],[],[],[],['Nội thất cao cấp'],[],[],['Hẻm xe hơi'],[],"190,28 triệu/m²","6,85 tỷ- 36 m2đ"
1072,Hẻm XH 17C NTMK . DT 6x12 hầm 3 lầu,"17c, Nguyễn Thị Minh Khai, Phường Bến Nghé, Quận 1, Tp Hồ Chí Minh",[],[],[],[],[],70 m²,280 m²,4 phòng,5 phòng,[],[],6 m,12 m,[],[],['Đã có sổ'],['Nhà biệt thự'],[],[],[],[],[],[],[],[],[],"292,86 triệu/m²","20,5 tỷ- 70 m2đ"
1073,Nhà hẻm Nguyễn Thái Bình Quận 1 Giá Chốt Sâu,"Đường Nguyễn Thái Bình, Phường Nguyễn Thái Bình, Quận 1, Tp Hồ Chí Minh",[],[],[],[],[],50 m²,200 m²,5 phòng,3 phòng,4,[],3.7 m,14.5 m,['Tây Nam'],[],['Đã có sổ'],"['Nhà ngõ, hẻm']",[],[],[],[],['Hoàn thiện cơ bản'],[],[],[],[],270 triệu/m²,"13,5 tỷ- 50 m2đ"
1074,Mặt Tiền 1438 Hai Bà Trưng 92m2 4 Tầng,"Gọi ĐT 0833083123 & 0902187404, 1277B Trần 136/24 Lê Nguyễn 608 Thượng Xu 13 Đình Đức Hiền 4 Thọ 42/44B Kiệm, Phường Bến Thành, Quận 1, Tp Hồ Chí Minh",[],[],[],[],[],8765 m²,[],nhiều hơn 10 phòng,[],[],[],[],[],[],[],[],"['Nhà mặt phố, mặt tiền']",[],[],[],[],[],[],[],[],['Cần mua'],"2,19 triệu/m²","19,2 tỷ- 8.765 m2đ"
1075,Nhà HXH 8m 1546 Lê Thánh Tôn 328M2 4 Tầng,"Gọi ĐT 0833083123 & 0902187404, 1277B Trần 136/24 Lê Nguyễn 608 Thượng Xu 13 Đình Đức Hiền 4 Thọ 42/44B Kiệm, Phường Bến Thành, Quận 1, Tp Hồ Chí Minh",[],[],[],[],[],8765 m²,[],nhiều hơn 10 phòng,[],[],[],[],[],[],[],[],"['Nhà mặt phố, mặt tiền']",[],[],[],[],[],[],[],[],['Cần mua'],"2,62 triệu/m²",23 tỷ- 8.765 m2đ
1076,CHDV 1766 Nguyễn Tất Thành 3507M2 10 TẦNG,"Gọi ĐT 0833083123 & 0902187404, 1277B Trần 136/24 Lê Nguyễn 608 Thượng Xu 13 Đình Đức Hiền 4 Thọ 42/44B Kiệm, Phường Bến Thành, Quận 1, Tp Hồ Chí Minh",[],[],[],[],[],8765 m²,[],nhiều hơn 10 phòng,[],[],[],[],[],[],[],[],"['Nhà mặt phố, mặt tiền']",[],[],[],[],[],[],[],[],['Cần mua'],"4,56 triệu/m²",40 tỷ- 8.765 m2đ
1077,"Bán nhà chính chủ, hẻm xe hoi tới nhà","88/89, Nguyễn Van Quy, Phường Nguyễn Cư Trinh, Quận 1, Tp Hồ Chí Minh",[],[],[],[],[],81 m²,158 m²,3 phòng,4 phòng,[],[],4 m,20 m,['Tây Nam'],[],['Đã có sổ'],"['Nhà mặt phố, mặt tiền']",[],[],[],[],[],[],[],['Hẻm xe hơi'],[],"60,49 triệu/m²","4,9 tỷ- 81 m2đ"
1078,MT TRẦN HƯNG ĐẠO . PHƯỜNG NGUYỄN CƯ TRINH . QUẬN 1,"Đường Trần Hưng Đạo, Phường Nguyễn Cư Trinh, Quận 1, Tp Hồ Chí Minh",[],[],[],[],[],78 m²,[],6 phòng,Nhiều hơn 6 phòng,6,[],4 m,20 m,[],[],['Đã có sổ'],"['Nhà mặt phố, mặt tiền']",[],[],[],[],['Nội thất cao cấp'],[],[],"['Hẻm xe hơi', 'Nở hậu']",[],"282,05 triệu/m²",22 tỷ- 78 m2đ
1079,Mặt Tiền 1727 Nguyễn Trãi 759M2 3 Tầng,"Gọi ĐT 0833083123 & 0902187404, 1277B Trần 136/24 Lê Nguyễn 608 Thượng Xu 13 Đình Đức Hiền 4 Thọ 42/44B Kiệm, Phường Bến Thành, Quận 1, Tp Hồ Chí Minh",[],[],[],[],[],8765 m²,[],nhiều hơn 10 phòng,[],[],[],[],[],[],[],[],"['Nhà mặt phố, mặt tiền']",[],[],[],[],[],[],[],[],['Cần mua'],"6,27 triệu/m²",55 tỷ- 8.765 m2đ
1080,Nhà HXH 8m 1729 Trần Hưng Đạo 527M2 6 Tầng,"Gọi ĐT 0833083123 & 0902187404, 1277B Trần 136/24 Lê Nguyễn 608 Thượng Xu 13 Đình Đức Hiền 4 Thọ 42/44B Kiệm, Phường Bến Thành, Quận 1, Tp Hồ Chí Minh",[],[],[],[],[],7652 m²,[],nhiều hơn 10 phòng,[],[],[],[],[],[],[],[],"['Nhà mặt phố, mặt tiền']",[],[],[],[],[],[],[],[],['Cần mua'],"2,16 triệu/m²","16,5 tỷ- 7.652 m2đ"
1081,Cần bán nhà Quận 1,"Đường Nguyễn Trãi, Phường Bến Thành, Quận 1, Tp Hồ Chí Minh",[],[],[],[],[],160 m²,160 m²,4 phòng,5 phòng,5,[],5 m,8 m,[],[],['Đã có sổ'],"['Nhà ngõ, hẻm']",[],[],[],[],['Nội thất đầy đủ'],[],[],['Hẻm xe hơi'],[],"93,75 triệu/m²",15 tỷ- 160 m2đ
1082,"Nhà đẹp 4 tầng HXH 7m Trần Hưng Đạo,P.Cầu Kho,Q1","Đường Trần Hưng Đạo, Phường Cầu Kho, Quận 1, Tp Hồ Chí Minh",[],[],[],[],[],30 m²,[],3 phòng,4 phòng,[],[],[],[],['Đông Bắc'],[],['Đã có sổ'],"['Nhà ngõ, hẻm']",[],[],[],[],['Nội thất cao cấp'],[],[],['Hẻm xe hơi'],[],260 triệu/m²,"7,8 tỷ- 30 m2đ"
1083,Mặt Tiền Quận 1 (dt:1052m2) khu trung tâm,"Đường Nguyễn Du, Phường Bến Thành, Quận 1, Tp Hồ Chí Minh",[],[],[],[],[],1052 m²,[],2 phòng,[],[],[],[],[],[],[],[],"['Nhà mặt phố, mặt tiền']",[],[],[],[],[],[],[],[],[],"807,98 triệu/m²",850 tỷ- 1.052 m2đ
1084,"Chính chủ nhà 2 mặt tiền hẻm ôtô Nguyễn Trải, Q1","150, Đường Nguyễn Trãi, Phường Bến Thành, Quận 1, Tp Hồ Chí Minh",[],[],[],[],[],81 m²,90 m²,1 phòng,1 phòng,[],[],4.1 m,20 m,[],[],['Đã có sổ'],"['Nhà ngõ, hẻm']",[],[],[],[],[],[],[],"['Hẻm xe hơi', 'Nở hậu']",[],"327,16 triệu/m²","26,5 tỷ- 81 m2đ"
1085,"Nhà Q.1 Góc 3 MT Đoạn Hai Bà Trưng - 5x28m, Hầm 7L","Hai Bà Trưng, Phường Tân Định, Quận 1, Tp Hồ Chí Minh",[],[],[],[],[],116 m²,[],nhiều hơn 10 phòng,1 phòng,8,[],5 m,28 m,[],[],['Đã có sổ'],"['Nhà mặt phố, mặt tiền']",[],[],[],[],['Nội thất cao cấp'],[],[],"['Hẻm xe hơi', 'Nở hậu']",[],"258,62 triệu/m²",30 tỷ- 116 m2đ
1086,CỰC PHẨM góc 2MT Võ Thị Sáu Q.1 5x25m DTCN: 106m2,"Đường Võ Thị Sáu, Phường Tân Định, Quận 1, Tp Hồ Chí Minh",[],[],[],[],[],126 m²,110 m²,4 phòng,5 phòng,[],[],5 m,25 m,[],[],[],"['Nhà mặt phố, mặt tiền']",[],[],[],[],[],[],[],[],[],"246,03 triệu/m²",31 tỷ- 126 m2đ
1087,Nhà Q.3 Góc 3 Mặt Tiền Võ Thị Sáu - 5x28m - Hầm 7L,"Đường Võ Thị Sáu, Phường Tân Định, Quận 1, Tp Hồ Chí Minh",[],[],[],[],[],116 m²,[],2 phòng,1 phòng,8,[],5 m,28 m,[],[],['Đã có sổ'],"['Nhà mặt phố, mặt tiền']",[],[],[],[],['Nội thất đầy đủ'],[],[],"['Hẻm xe hơi', 'Nở hậu']",[],"258,62 triệu/m²",30 tỷ- 116 m2đ
1088,"Chính chủ 7ty bán gấp 6ty550❤3,6x17m hẻm ba gác Q1","25/30, Đường Trần Khắc Chân, Phường Tân Định, Quận 1, Tp Hồ Chí Minh",[],[],[],[],[],55 m²,71 m²,2 phòng,2 phòng,1,[],360 m,17 m,['Nam'],[],['Đã có sổ'],"['Nhà ngõ, hẻm']",[],[],[],[],['Nội thất cao cấp'],[],[],[],[],"119,09 triệu/m²","6,55 tỷ- 55 m2đ"
1089,"DT(7x10), hạ giá còn 8,1tỷ Hẻm 214B Nguyễn Trãi,Q1","Đường Nguyễn Trãi, Phường Nguyễn Cư Trinh, Quận 1, Tp Hồ Chí Minh",[],[],[],[],[],62 m²,[],3 phòng,2 phòng,2,[],7 m,10 m,[],[],['Đã có sổ'],"['Nhà ngõ, hẻm']",[],[],[],[],[],[],[],"['Hẻm xe hơi', 'Nở hậu']",[],"130,65 triệu/m²","8,1 tỷ- 62 m2đ"
1090,"Hẻm nội bộ Bùi Thị Xuân, Q1. Nhà khu VIP, giá rẻ","Đường Bùi Thị Xuân, Phường Phạm Ngũ Lão, Quận 1, Tp Hồ Chí Minh",[],[],[],[],[],58 m²,[],6 phòng,6 phòng,[],[],[],[],[],[],['Đã có sổ'],"['Nhà ngõ, hẻm']",[],[],[],[],[],[],[],"['Hẻm xe hơi', 'Nở hậu']",[],"187,93 triệu/m²","10,9 tỷ- 58 m2đ"
1091,Nhà HXH Quận 1 4 tầng 4x17.9m2 4 phòng 5 WC,"Đường Nguyễn Bỉnh Khiêm, Phường Đa Kao, Quận 1, Tp Hồ Chí Minh",[],[],[],[],[],66.8 m²,267.2 m²,4 phòng,5 phòng,[],[],4 m,17.9 m,[],[],[],"['Nhà ngõ, hẻm']",[],[],[],[],[],[],[],[],[],"363,64 triệu/m²",24 tỷ- 66.8 m2đ
1092,"Siêu phẩm ko có căn t2, mt phan văn trường 39 tỷ","phan văn trường, Phường Cầu Ông Lãnh, Quận 1, Tp Hồ Chí Minh",[],[],[],[],[],74 m²,[],3 phòng,[],[],[],[],[],[],[],['Đã có sổ'],"['Nhà mặt phố, mặt tiền']",[],[],[],[],[],[],[],[],[],"527,03 triệu/m²",39 tỷ- 74 m2đ
1093,🏠🏠🏠BÁN NHÀ ĐẤT ( tặng nội thất gỗ quý ) 🏡🏡🏡,"Đường Tôn Đức Thắng, Phường Bến Nghé, Quận 1, Tp Hồ Chí Minh",[],[],[],[],[],384 m²,384 m²,4 phòng,5 phòng,[],[],9 m,40 m,['Tây'],[],['Đã có sổ'],"['Nhà mặt phố, mặt tiền']",[],[],[],[],['Nội thất cao cấp'],[],[],[],[],"24,74 triệu/m²","9,5 tỷ- 384 m2đ"
1094,Nhà góc 2MT Quận 1 - SHR - Nhà đẹp giá tốt !!,"Đường Trần Hưng Đạo, Phường Cầu Kho, Quận 1, Tp Hồ Chí Minh",[],[],[],[],[],43 m²,172 m²,5 phòng,5 phòng,[],[],3.1 m,15.2 m,['Tây Bắc'],[],['Đã có sổ'],"['Nhà ngõ, hẻm']",[],[],[],[],['Nội thất đầy đủ'],[],[],['Hẻm xe hơi'],[],"267,44 triệu/m²","11,5 tỷ- 43 m2đ"
1095,"MT Đinh Tiên Hoàng, Q1. DT 4x20m, T+4L. Giá 24 tỷ","Đường Đinh Tiên Hoàng, Phường Đa Kao, Quận 1, Tp Hồ Chí Minh",[],[],[],[],[],80 m²,[],5 phòng,5 phòng,[],[],4 m,20 m,[],[],['Đã có sổ'],"['Nhà mặt phố, mặt tiền']",[],[],[],[],[],[],[],[],[],300 triệu/m²,24 tỷ- 80 m2đ
1096,Bán nhà Nguyên căn hẻm xe hơi Trần Hưng Đạọ Q1,"Đường Trần Hưng Đạo, Phường Cầu Kho, Quận 1, Tp Hồ Chí Minh",[],[],[],[],[],30 m²,90 m²,4 phòng,5 phòng,[],[],3 m,10 m,[],[],[],"['Nhà ngõ, hẻm']",[],[],[],[],[],[],[],[],[],"186,67 triệu/m²","5,6 tỷ- 30 m2đ"
1097,nhà đẹp 2 tầng mới như hình Trần Quang Khải quận 1,"Đường Trần Quang Khải, Phường Tân Định, Quận 1, Tp Hồ Chí Minh",[],[],[],[],[],25 m²,50 m²,2 phòng,2 phòng,2,[],5 m,5 m,[],[],['Đã có sổ'],"['Nhà ngõ, hẻm']",[],[],[],[],[],[],[],['Hẻm xe hơi'],[],148 triệu/m²,"3,7 tỷ- 25 m2đ"
1098,Bán Nhà quận 1 cần bán,"Đường Huyền Quang, Phường Tân Định, Quận 1, Tp Hồ Chí Minh",[],[],[],[],[],163 m²,[],3 phòng,[],[],[],[],[],['Đông Nam'],[],['Đã có sổ'],"['Nhà ngõ, hẻm']",[],[],[],[],[],[],[],['Hẻm xe hơi'],[],"187,12 triệu/m²","30,5 tỷ- 163 m2đ"
1099,"Bán nhà chính chủ, hẻm xe hoi tới nhà","88/89, Nguyễn Van Quy, Phường Nguyễn Cư Trinh, Quận 1, Tp Hồ Chí Minh",[],[],[],[],[],81 m²,158 m²,3 phòng,4 phòng,[],[],4 m,20 m,['Tây Nam'],[],['Đã có sổ'],"['Nhà mặt phố, mặt tiền']",[],[],[],[],[],[],[],['Hẻm xe hơi'],[],"60,49 triệu/m²","4,9 tỷ- 81 m2đ"
1100,MT TRẦN HƯNG ĐẠO . PHƯỜNG NGUYỄN CƯ TRINH . QUẬN 1,"Đường Trần Hưng Đạo, Phường Nguyễn Cư Trinh, Quận 1, Tp Hồ Chí Minh",[],[],[],[],[],78 m²,[],6 phòng,Nhiều hơn 6 phòng,6,[],4 m,20 m,[],[],['Đã có sổ'],"['Nhà mặt phố, mặt tiền']",[],[],[],[],['Nội thất cao cấp'],[],[],"['Hẻm xe hơi', 'Nở hậu']",[],"282,05 triệu/m²",22 tỷ- 78 m2đ
1101,CHỦ NGỘP BÁN GẤP - GIẢM CHÀO CÒN 3.65 TỶ - QUẬN 1,"Đường Trần Quang Khải, Phường Tân Định, Quận 1, Tp Hồ Chí Minh",[],[],[],[],[],26 m²,[],2 phòng,[],[],[],[],[],[],[],[],"['Nhà ngõ, hẻm']",[],[],[],[],[],[],[],[],[],"140,38 triệu/m²","3,65 tỷ- 26 m2đ"
