,title,address,project_name,apartment_code,block_name,block_code,square,square_area,square_in_use,bedroom,wc,num_floor,floor,width,height,door,balcony,certificates,house_type,estate_type,office_type,apartment_type,status,furniture_status,estate_status,apartment_specific,house_specific,_type,price_m2,price_square
510,"GIA ĐÌNH TÔI BÁN NHÀ HAI BÀ TRƯNG Q1,GIÁ 913TR/SHR","Đường Hai Bà Trưng, Phường Tân Định, Quận 1, Tp Hồ Chí Minh",[],[],[],[],[],45 m²,[],2 phòng,2 phòng,1,[],4 m,11 m,[],[],['Đã có sổ'],"['Nhà ngõ, hẻm']",[],[],[],[],['Hoàn thiện cơ bản'],[],[],['Hẻm xe hơi'],[],"20,29 triệu/m²",913 triệu- 45 m2đ
511,Bán nhà có sẵn hợp đồng cho thuê 35 triệu,"Đường Nguyễn Trãi, Phường Nguyễn Cư Trinh, Quận 1, Tp Hồ Chí Minh",[],[],[],[],[],68 m²,320 m²,7 phòng,Nhiều hơn 6 phòng,[],[],4 m,17 m,['Đông Bắc'],[],['Đã có sổ'],"['Nhà ngõ, hẻm']",[],[],[],[],['Nội thất đầy đủ'],[],[],['Nở hậu'],[],"230,38 triệu/m²","15,666 tỷ- 68 m2đ"
512,"Bán MT Phường Bến Nghé, Q1 ngang 6.3m 55tr, 27tỷ,","Đường Nguyễn Thị Minh Khai, Phường Bến Nghé, Quận 1, Tp Hồ Chí Minh",[],[],[],[],[],44 m²,220 m²,5 phòng,5 phòng,[],[],6.3 m,[],[],[],[],"['Nhà mặt phố, mặt tiền']",[],[],[],[],[],[],[],[],[],"613,64 triệu/m²",27 tỷ- 44 m2đ
513,Tôi 9 chủ cần bán nhà mới 100% . Hẽm XH H.Sa Q1,"245/, Đường Hoàng Sa, Phường Tân Định, Quận 1, Tp Hồ Chí Minh",[],[],[],[],[],30 m²,145 m²,5 phòng,3 phòng,4,[],4 m,8 m,['Đông'],[],['Đã có sổ'],"['Nhà ngõ, hẻm']",[],[],[],[],['Nội thất đầy đủ'],[],[],"['Hẻm xe hơi', 'Nở hậu']",[],"194,17 triệu/m²","5,825 tỷ- 30 m2đ"
514,"BÁN NHÀ 1T1L HAI BÀ TRƯNG/Q1 40m2/1ty50tr,SHR","Đường Hai Bà Trưng, Phường Đa Kao, Quận 1, Tp Hồ Chí Minh",[],[],[],[],[],40 m²,80 m²,2 phòng,2 phòng,2,[],4 m,10 m,[],[],['Đã có sổ'],"['Nhà mặt phố, mặt tiền']",[],[],[],[],['Nội thất cao cấp'],[],[],['Hẻm xe hơi'],[],"26,25 triệu/m²","1,05 tỷ- 40 m2đ"
515,"Bán nhà HXH cách mt hoàng sa 10m,đang hđ thuê 25tr","Đường Hoàng Sa, Phường Tân Định, Quận 1, Tp Hồ Chí Minh",[],[],[],[],[],30 m²,61.3 m²,4 phòng,[],[],[],3.9 m,7.5 m,[],[],[],"['Nhà mặt phố, mặt tiền']",[],[],[],[],[],[],[],[],[],"265,67 triệu/m²","7,97 tỷ- 30 m2đ"
516,"Bán nhà Trần Khắc Chân, xách Vali vào ở liền","Đường Trần Khắc Chân, Phường Tân Định, Quận 1, Tp Hồ Chí Minh",[],[],[],[],[],28 m²,110.7 m²,2 phòng,2 phòng,[],[],[],[],[],[],['Đã có sổ'],"['Nhà ngõ, hẻm']",[],[],[],[],['Nội thất đầy đủ'],[],[],[],[],"278,57 triệu/m²","7,8 tỷ- 28 m2đ"
517,"Bán GẤP 1Trệt 3 lầu, HXH Trần Hưng Đạo Q1, 5.2 tỷ","Đường Trần Hưng Đạo, Phường Cầu Kho, Quận 1, Tp Hồ Chí Minh",[],[],[],[],[],35 m²,120 m²,4 phòng,4 phòng,[],[],3 m,11 m,[],[],[],"['Nhà ngõ, hẻm']",[],[],[],[],[],[],[],[],[],"148,57 triệu/m²","5,2 tỷ- 35 m2đ"
518,"CC BÁN NHÀ 76M2 ĐINH TIÊN HOÀNG-Q1-TT 1,4 TỶ 70TR","Đường Đinh Tiên Hoàng, Phường Đa Kao, Quận 1, Tp Hồ Chí Minh",[],[],[],[],[],76 m²,76 m²,3 phòng,2 phòng,2,[],5 m,15.2 m,['Đông Nam'],[],['Đã có sổ'],"['Nhà mặt phố, mặt tiền']",[],[],[],[],['Nội thất đầy đủ'],[],[],"['Hẻm xe hơi', 'Nở hậu']",[],"19,34 triệu/m²","1,47 tỷ- 76 m2đ"
519,Mình Cần Bán Nhà Khu Vực Quận 1!,"Đường Nguyễn Thị Minh Khai, Phường Đa Kao, Quận 1, Tp Hồ Chí Minh",[],[],[],[],[],50 m²,150 m²,4 phòng,3 phòng,2,[],4 m,13 m,[],[],['Đã có sổ'],"['Nhà ngõ, hẻm']",[],[],[],[],['Bàn giao thô'],[],[],['Hẻm xe hơi'],[],280 triệu/m²,14 tỷ- 50 m2đ
520,CẦN BÁN GẤP CĂN NHÀ QUẬN 1-30m2-2TẦNG-7.5TỶ,"Đường Trần Hưng Đạo, Phường Cầu Kho, Quận 1, Tp Hồ Chí Minh",[],[],[],[],[],30 m²,30 m²,2 phòng,2 phòng,2,[],3.1 m,10 m,[],[],['Đã có sổ'],"['Nhà ngõ, hẻm']",[],[],[],[],[],[],[],['Hẻm xe hơi'],[],250 triệu/m²,"7,5 tỷ- 30 m2đ"
521,Căn góc 2MT đường NĐC Q.1 Hẻm 10m HĐT:65tr chỉ 25T,"Đường Nguyễn Thị Minh Khai, Phường Đa Kao, Quận 1, Tp Hồ Chí Minh",[],[],[],[],[],100 m²,217 m²,4 phòng,4 phòng,4,[],10 m,10 m,['Đông Bắc'],[],['Đã có sổ'],"['Nhà ngõ, hẻm']",[],[],[],[],['Hoàn thiện cơ bản'],[],[],['Hẻm xe hơi'],[],250 triệu/m²,25 tỷ- 100 m2đ
522,Bán Nhà MT Phạm Viết Chánh Q1,"Đường Phạm Viết Chánh, Phường Nguyễn Cư Trinh, Quận 1, Tp Hồ Chí Minh",[],[],[],[],[],132 m²,288 m²,2 phòng,[],[],[],11 m,13 m,['Tây Bắc'],[],['Đã có sổ'],"['Nhà mặt phố, mặt tiền']",[],[],[],[],[],[],[],[],[],"530,3 triệu/m²",70 tỷ- 132 m2đ
523,Sang Nhượng Ngay Kí Ốt Kèm Dãy Trọ Ngay Thuận An,"D3, Phường Đa Kao, Quận 1, Tp Hồ Chí Minh",[],[],[],[],[],150 m²,200 m²,1 phòng,1 phòng,[],[],5 m,30 m,[],[],['Đã có sổ'],"['Nhà mặt phố, mặt tiền']",[],[],[],[],[],[],[],[],[],"10,2 triệu/m²","1,53 tỷ- 150 m2đ"
524,Bán nhà MT đường Nguyễn Văn Tráng (đoạn đẹp),"Đường Nguyễn Văn Tráng, Phường Bến Thành, Quận 1, Tp Hồ Chí Minh",[],[],[],[],[],68 m²,136 m²,3 phòng,2 phòng,[],[],3.8 m,18 m,[],[],[],"['Nhà mặt phố, mặt tiền']",[],[],[],[],[],[],[],[],[],"470,59 triệu/m²",32 tỷ- 68 m2đ
525,Góc 2 MT đường Trần Khắc Chân. 9mx24. GPXL H-8L,"Đường Đặng Dung, Phường Tân Định, Quận 1, Tp Hồ Chí Minh",[],[],[],[],[],216 m²,216 m²,1 phòng,1 phòng,[],[],9 m,24 m,[],[],[],"['Nhà mặt phố, mặt tiền']",[],[],[],[],[],[],[],[],[],"277,78 triệu/m²",60 tỷ- 216 m2đ
526,Chính chủ cần bán nhà 2Mt Đinh Tiên Hoàng,"Đường Đinh Tiên Hoàng, Phường Đa Kao, Quận 1, Tp Hồ Chí Minh",[],[],[],[],[],74.9 m²,[],4 phòng,[],[],[],[],[],[],[],['Đã có sổ'],"['Nhà mặt phố, mặt tiền']",[],[],[],[],[],[],[],[],[],"283,78 triệu/m²",21 tỷ- 74.9 m2đ
527,"Nhà HXH8m Trần Hưng Đạo - DT:(4,5 x16,2) 2 Lầu, St","Đường Trần Hưng Đạo, Phường Cầu Kho, Quận 1, Tp Hồ Chí Minh",[],[],[],[],[],72 m²,[],4 phòng,5 phòng,[],[],[],[],['Tây Bắc'],[],['Đã có sổ'],"['Nhà ngõ, hẻm']",[],[],[],[],[],[],[],"['Hẻm xe hơi', 'Nở hậu']",[],"205,56 triệu/m²","14,8 tỷ- 72 m2đ"
528,"Bán nhà chính chủ, hẻm xe hoi tới nhà","88/89, Nguyễn Van Quy, Phường Nguyễn Cư Trinh, Quận 1, Tp Hồ Chí Minh",[],[],[],[],[],81 m²,158 m²,3 phòng,4 phòng,[],[],4 m,20 m,['Tây Nam'],[],['Đã có sổ'],"['Nhà mặt phố, mặt tiền']",[],[],[],[],[],[],[],['Hẻm xe hơi'],[],"60,49 triệu/m²","4,9 tỷ- 81 m2đ"
529,MT TRẦN HƯNG ĐẠO . PHƯỜNG NGUYỄN CƯ TRINH . QUẬN 1,"Đường Trần Hưng Đạo, Phường Nguyễn Cư Trinh, Quận 1, Tp Hồ Chí Minh",[],[],[],[],[],78 m²,[],6 phòng,Nhiều hơn 6 phòng,6,[],4 m,20 m,[],[],['Đã có sổ'],"['Nhà mặt phố, mặt tiền']",[],[],[],[],['Nội thất cao cấp'],[],[],"['Hẻm xe hơi', 'Nở hậu']",[],"282,05 triệu/m²",22 tỷ- 78 m2đ
530,NHÀ 1 TRỆT 3 LẦU QUẬN 1 GIÁ 7 TỶ,"Đường Đề Thám, Phường Cầu Ông Lãnh, Quận 1, Tp Hồ Chí Minh",[],[],[],[],[],25 m²,25 m²,5 phòng,5 phòng,[],[],5 m,5 m,['Đông Nam'],[],['Đã có sổ'],"['Nhà mặt phố, mặt tiền']",[],[],[],[],['Nội thất cao cấp'],[],[],[],[],280 triệu/m²,7 tỷ- 25 m2đ
531,Bán Nhà Trung Tâm Quận 1,"115, Đường Trần Hưng Đạo, Phường Cầu Kho, Quận 1, Tp Hồ Chí Minh",[],[],[],[],[],30 m²,28 m²,3 phòng,5 phòng,[],[],32 m,8 m,['Tây Nam'],[],['Đã có sổ'],"['Nhà ngõ, hẻm']",[],[],[],[],[],[],[],['Nở hậu'],[],165 triệu/m²,"4,95 tỷ- 30 m2đ"
532,NHÀ MỚI QUẬN 1 GIÁ RẺ CẦN BÁN GẤP,"Đường Võ Văn Kiệt, Phường Cô Giang, Quận 1, Tp Hồ Chí Minh",[],[],[],[],[],19 m²,60 m²,2 phòng,2 phòng,2,[],[],[],[],[],['Đã có sổ'],"['Nhà ngõ, hẻm']",[],[],[],[],['Nội thất đầy đủ'],[],[],[],[],"215,79 triệu/m²","4,1 tỷ- 19 m2đ"
533,2 căn liền kề phố đi bộ Bùi Viện 70m2,"Đường Bùi Viện, Phường Phạm Ngũ Lão, Quận 1, Tp Hồ Chí Minh",[],[],[],[],[],70 m²,200 m²,7 phòng,Nhiều hơn 6 phòng,[],[],8 m,9 m,['Tây Bắc'],[],['Đã có sổ'],"['Nhà ngõ, hẻm']",[],[],[],[],['Nội thất đầy đủ'],[],[],[],[],"228,57 triệu/m²",16 tỷ- 70 m2đ
534,Bán Nhà Ngay Chi Cục Thuế Quận: KDC Cao Cấp,"Đường Tôn Đức Thắng, Phường Nguyễn Thái Bình, Quận 1, Tp Hồ Chí Minh",[],[],[],[],[],96 m²,259 m²,6 phòng,6 phòng,3,[],4.5 m,20 m,['Nam'],[],['Đã có sổ'],"['Nhà mặt phố, mặt tiền']",[],[],[],[],['Nội thất cao cấp'],[],[],['Hẻm xe hơi'],[],"83,33 triệu/m²",8 tỷ- 96 m2đ
535,"Bán nhà 2 tầng Quận 1, gần phố tây Bùi Viện - 22m2","Đường Cô Bắc, Phường Cô Giang, Quận 1, Tp Hồ Chí Minh",[],[],[],[],[],22 m²,22 m²,1 phòng,1 phòng,[],[],[],[],[],[],['Đã có sổ'],"['Nhà ngõ, hẻm']",[],[],[],[],[],[],[],"['Hẻm xe hơi', 'Nở hậu']",[],"81,82 triệu/m²","1,8 tỷ- 22 m2đ"
536,"CHÍNH CHỦ CẦN BÁN GẤP NHÀ 1TRỆT 3 LẦU, KD CHDV","65/1, Đường Đề Thám, Phường Cầu Ông Lãnh, Quận 1, Tp Hồ Chí Minh",[],[],[],[],[],80 m²,[],3 phòng,3 phòng,3,[],[],[],[],[],['Đã có sổ'],"['Nhà ngõ, hẻm']",[],[],[],[],['Nội thất cao cấp'],[],[],[],[],"87,5 triệu/m²",7 tỷ- 80 m2đ
537,"Định Cư bán gấp, Nguyễn Trãi, Quận 1 68m²- 6.8 tỷ","214, Đường Nguyễn Trãi, Phường Nguyễn Cư Trinh, Quận 1, Tp Hồ Chí Minh",[],[],[],[],[],68 m²,136 m²,4 phòng,4 phòng,2,[],6 m,12 m,[],[],['Đã có sổ'],"['Nhà ngõ, hẻm']",[],[],[],[],['Nội thất đầy đủ'],[],[],['Nở hậu'],[],100 triệu/m²,"6,8 tỷ- 68 m2đ"
538,"""Nhà hẻm xe hơi đường Nguyễn Bỉnh Khiêm, P.BN, Q1","/, Đường Nguyễn Bỉnh Khiêm, Phường Bến Nghé, Quận 1, Tp Hồ Chí Minh",[],[],[],[],[],61.2 m²,[],3 phòng,3 phòng,3,[],5.2 m,10.6 m,['Tây Bắc'],[],['Đã có sổ'],"['Nhà ngõ, hẻm']",[],[],[],[],['Nội thất đầy đủ'],[],[],"['Hẻm xe hơi', 'Nở hậu']",[],"360,66 triệu/m²",22 tỷ- 61.2 m2đ
539,Nhà MT Nguyễn Thái Học Q1 HĐT 3800$/tháng. 39 tỷ,"Đường Nguyễn Thái Học, Phường Cầu Ông Lãnh, Quận 1, Tp Hồ Chí Minh",[],[],[],[],[],83 m²,[],3 phòng,[],[],[],4.2 m,20 m,[],[],['Đã có sổ'],"['Nhà mặt phố, mặt tiền']",[],[],[],[],[],[],[],[],[],"469,88 triệu/m²",39 tỷ- 83 m2đ
540,TÔI ĐANG CẦN BÁN GẤP QUẬN 1 - 70M -4PN- CHÍNH CHỦ,"Đường Nguyễn Trãi, Phường Nguyễn Cư Trinh, Quận 1, Tp Hồ Chí Minh",[],[],[],[],[],70 m²,70 m²,4 phòng,4 phòng,[],[],6 m,12 m,[],[],[],"['Nhà ngõ, hẻm']",[],[],[],[],[],[],[],[],[],"97,14 triệu/m²","6,8 tỷ- 70 m2đ"
541,Nhà Hiếm có Nguyễn Cảnh Chân Quận 1 HXH Giá 7.5 tỷ,"Nguyễn Cảnh Chân, Phường Cầu Kho, Quận 1, Tp Hồ Chí Minh",[],[],[],[],[],30 m²,60 m²,2 phòng,2 phòng,[],[],3 m,10 m,[],[],['Đã có sổ'],"['Nhà ngõ, hẻm']",[],[],[],[],[],[],[],['Hẻm xe hơi'],[],250 triệu/m²,"7,5 tỷ- 30 m2đ"
542,Bán nhà cấp4 MT Q1 (4x17) (238tr/m2 16.2ty),"Đường Trần Khánh Dư, Phường Tân Định, Quận 1, Tp Hồ Chí Minh",[],[],[],[],[],68 m²,[],1 phòng,1 phòng,[],[],[],[],[],[],['Đã có sổ'],"['Nhà mặt phố, mặt tiền']",[],[],[],[],[],[],[],[],[],"238,24 triệu/m²","16,2 tỷ- 68 m2đ"
543,CC bán nhà Trường Sa đang có HDT 50tr/th 19.9 ty,"Đường Hoàng Sa, Phường Đa Kao, Quận 1, Tp Hồ Chí Minh",[],[],[],[],[],100 m²,[],2 phòng,2 phòng,[],[],[],[],[],[],['Đã có sổ'],"['Nhà mặt phố, mặt tiền']",[],[],[],[],[],[],[],[],[],"191,01 triệu/m²","19,101 tỷ- 100 m2đ"
544,"SIÊU PHẨM NHÀ CỐNG QUỲNH,Q1,42m2,1T1L HẺM OTO SHR","Đường Cống Quỳnh, Phường Nguyễn Cư Trinh, Quận 1, Tp Hồ Chí Minh",[],[],[],[],[],42 m²,[],2 phòng,2 phòng,1,[],4.2 m,10 m,[],[],['Đã có sổ'],"['Nhà ngõ, hẻm']",[],[],[],[],['Nội thất đầy đủ'],[],[],"['Hẻm xe hơi', 'Nở hậu']",[],"24,4 triệu/m²","1,025 tỷ- 42 m2đ"
545,KẸT VỐN KINH DOANH BÁN NHÀ NGUYỄN CƯ TRINH Q1 57m2,"Đường Nguyễn Cư Trinh, Phường Nguyễn Cư Trinh, Quận 1, Tp Hồ Chí Minh",[],[],[],[],[],57 m²,114 m²,2 phòng,3 phòng,[],[],5 m,11.4 m,[],[],['Đã có sổ'],"['Nhà ngõ, hẻm']",[],[],[],[],[],[],[],"['Hẻm xe hơi', 'Nở hậu']",[],"25,67 triệu/m²","1,463 tỷ- 57 m2đ"
546,Bán Nhà Mặt Tiền Gần ngay Trần Hưng Đạo Q1 5 Tầng,"Nguyễn Cảnh Chân, Phường Cầu Kho, Quận 1, Tp Hồ Chí Minh",[],[],[],[],[],40 m²,[],5 phòng,[],[],[],[],[],[],[],['Đã có sổ'],"['Nhà mặt phố, mặt tiền']",[],[],[],[],[],[],[],[],[],"312,5 triệu/m²","12,5 tỷ- 40 m2đ"
547,Bán Nhà Đường Nguyễn Thị Minh Khai P.BN Q1 6x13m,"Đường Nguyễn Thị Minh Khai, Phường Bến Thành, Quận 1, Tp Hồ Chí Minh",[],[],[],[],[],80 m²,[],5 phòng,[],[],[],[],[],[],[],['Đã có sổ'],"['Nhà mặt phố, mặt tiền']",[],[],[],[],[],[],[],[],[],"243,75 triệu/m²","19,5 tỷ- 80 m2đ"
548,Bán Nhà Hẻm Xe Hơi Nguyễn Trãi Q1 4.5x15m 5 Tầng,"Đường Nguyễn Trãi, Phường Nguyễn Cư Trinh, Quận 1, Tp Hồ Chí Minh",[],[],[],[],[],60 m²,[],4 phòng,[],[],[],[],[],[],[],['Đã có sổ'],"['Nhà mặt phố, mặt tiền']",[],[],[],[],[],[],[],[],[],"208,33 triệu/m²","12,5 tỷ- 60 m2đ"
549,BÁN NHÀ ĐƯỜNG MẠC ĐỈNH CHI QUẬN 1 DT 60M2,"Đường Mạc Đĩnh Chi, Phường Đa Kao, Quận 1, Tp Hồ Chí Minh",[],[],[],[],[],60 m²,180 m²,4 phòng,5 phòng,3,[],4 m,15 m,[],[],['Đã có sổ'],"['Nhà mặt phố, mặt tiền']",[],[],[],[],[],[],[],[],[],85 triệu/m²,"5,1 tỷ- 60 m2đ"
550,"Bán nhà chính chủ, hẻm xe hoi tới nhà","88/89, Nguyễn Van Quy, Phường Nguyễn Cư Trinh, Quận 1, Tp Hồ Chí Minh",[],[],[],[],[],81 m²,158 m²,3 phòng,4 phòng,[],[],4 m,20 m,['Tây Nam'],[],['Đã có sổ'],"['Nhà mặt phố, mặt tiền']",[],[],[],[],[],[],[],['Hẻm xe hơi'],[],"60,49 triệu/m²","4,9 tỷ- 81 m2đ"
551,MT TRẦN HƯNG ĐẠO . PHƯỜNG NGUYỄN CƯ TRINH . QUẬN 1,"Đường Trần Hưng Đạo, Phường Nguyễn Cư Trinh, Quận 1, Tp Hồ Chí Minh",[],[],[],[],[],78 m²,[],6 phòng,Nhiều hơn 6 phòng,6,[],4 m,20 m,[],[],['Đã có sổ'],"['Nhà mặt phố, mặt tiền']",[],[],[],[],['Nội thất cao cấp'],[],[],"['Hẻm xe hơi', 'Nở hậu']",[],"282,05 triệu/m²",22 tỷ- 78 m2đ
552,BÁN NHÀ CHẠY DỊCH NGAY ĐƯỜNG CỐNG QUỲNH P.NCT Q.1,"Đường Cống Quỳnh, Phường Nguyễn Cư Trinh, Quận 1, Tp Hồ Chí Minh",[],[],[],[],[],53 m²,106 m²,3 phòng,3 phòng,[],[],5 m,10.6 m,[],[],['Đã có sổ'],"['Nhà ngõ, hẻm']",[],[],[],[],[],[],[],"['Hẻm xe hơi', 'Nở hậu']",[],"24,02 triệu/m²","1,273 tỷ- 53 m2đ"
553,"VỀ QUÊ SỐNG BÁN NHÀ TRẦN KHẮC CHÂN Q1, 1 TỶ 010TR","Đường Trần Khắc Chân, Phường Tân Định, Quận 1, Tp Hồ Chí Minh",[],[],[],[],[],51 m²,[],3 phòng,3 phòng,2,[],5 m,10 m,[],[],['Đã có sổ'],"['Nhà ngõ, hẻm']",[],[],[],[],['Hoàn thiện cơ bản'],[],[],['Hẻm xe hơi'],[],"19,8 triệu/m²","1,01 tỷ- 51 m2đ"
554,"PHÁ SẢN BÁN NHÀ TRẦN QUANG KHẢI,Q.1, 1TỶ 820, 90M2","Đường Trần Quang Khải, Phường Tân Định, Quận 1, Tp Hồ Chí Minh",[],[],[],[],[],90 m²,[],6 phòng,Nhiều hơn 6 phòng,[],[],6 m,15 m,[],[],['Đã có sổ'],"['Nhà ngõ, hẻm']",[],[],[],[],[],[],[],['Hẻm xe hơi'],[],"20,22 triệu/m²","1,82 tỷ- 90 m2đ"
555,Nhà Xinh Bán Gấp Trần Đình Xu Quận 1 44m2 768tr SH,"Đường Trần Đình Xu, Phường Cầu Kho, Quận 1, Tp Hồ Chí Minh",[],[],[],[],[],44 m²,132 m²,3 phòng,3 phòng,[],[],4 m,11 m,[],[],['Đã có sổ'],"['Nhà ngõ, hẻm']",[],[],[],[],[],[],[],['Hẻm xe hơi'],[],"17,45 triệu/m²",768 triệu- 44 m2đ
556,Cần Bán Căn Duplex nhỏ xinh ở Nguyễn Trãi Quận 1,"Đường Nguyễn Trãi, Phường Đa Kao, Quận 1, Tp Hồ Chí Minh",[],[],[],[],[],39 m²,78 m²,2 phòng,2 phòng,[],[],3.9 m,10 m,[],[],['Đã có sổ'],"['Nhà ngõ, hẻm']",[],[],[],[],[],[],[],['Hẻm xe hơi'],[],"18,95 triệu/m²",739 triệu- 39 m2đ
557,MT Quận 1 5Lầu 4x15 khu Hai Bà Trưng,"Đường Đinh Công Tráng, Phường Tân Định, Quận 1, Tp Hồ Chí Minh",[],[],[],[],[],56 m²,[],8 phòng,Nhiều hơn 6 phòng,[],[],[],[],[],[],[],"['Nhà mặt phố, mặt tiền']",[],[],[],[],[],[],[],[],[],"339,29 triệu/m²",19 tỷ- 56 m2đ
558,DỊCH KHÓ KHĂN BÁN NHÀ NGUYỄN CẢNH CHÂN Q1 1TY120TR,"Đường Nguyễn Cảnh Chân, Phường Cầu Kho, Quận 1, Tp Hồ Chí Minh",[],[],[],[],[],45 m²,[],2 phòng,2 phòng,[],[],5 m,9 m,[],[],['Đã có sổ'],"['Nhà ngõ, hẻm']",[],[],[],[],[],[],[],['Hẻm xe hơi'],[],"24,89 triệu/m²","1,12 tỷ- 45 m2đ"
559,CÒN SÓT 1 CĂN ĐƯỜNG MẠC ĐỈNH CHI P.ĐA KAO Q1 SH,"Đường Mạc Đĩnh Chi, Phường Đa Kao, Quận 1, Tp Hồ Chí Minh",[],[],[],[],[],56 m²,168 m²,4 phòng,4 phòng,[],[],5 m,11.2 m,[],[],['Đã có sổ'],"['Nhà ngõ, hẻm']",[],[],[],[],[],[],[],"['Hẻm xe hơi', 'Nở hậu']",[],"28,07 triệu/m²","1,572 tỷ- 56 m2đ"
560,"GẦN TẾT BÁN NHÀ 42m2 HXH CỐNG QUỲNH,Q1, CHỈ 1tỷ473","Đường Cống Quỳnh, Phường Phạm Ngũ Lão, Quận 1, Tp Hồ Chí Minh",[],[],[],[],[],42 m²,[],2 phòng,2 phòng,[],[],4 m,10 m,[],[],['Đã có sổ'],"['Nhà ngõ, hẻm']",[],[],[],[],[],[],[],['Hẻm xe hơi'],[],"35,07 triệu/m²","1,473 tỷ- 42 m2đ"
561,"Nhà 1 trệt 1 lửng 3 lầu, HXH, đường Hoàng Sa Q1","Đường Hoàng Sa, Phường Đa Kao, Quận 1, Tp Hồ Chí Minh",[],[],[],[],[],30 m²,140 m²,4 phòng,4 phòng,5,[],4 m,8 m,['Tây Bắc'],[],['Đã có sổ'],"['Nhà ngõ, hẻm']",[],[],[],[],['Nội thất đầy đủ'],[],[],['Hẻm xe hơi'],[],"266,67 triệu/m²",8 tỷ- 30 m2đ
562,Nhà hẻm đẹp 4m cô giang 2 lầu,"Đường Cô Giang, Phường Cô Giang, Quận 1, Tp Hồ Chí Minh",[],[],[],[],[],10 m²,30 m²,2 phòng,2 phòng,[],[],[],[],[],[],['Đã có sổ'],"['Nhà ngõ, hẻm']",[],[],[],[],[],[],[],"['Hẻm xe hơi', 'Nở hậu']",[],225 triệu/m²,"2,25 tỷ- 10 m2đ"
563,Bán Nhà Nhỏ Đẹp Trần Khánh Dư Quận 1,"Đường Trần Khánh Dư, Phường Tân Định, Quận 1, Tp Hồ Chí Minh",[],[],[],[],[],22 m²,22 m²,2 phòng,2 phòng,2,[],3 m,8 m,['Đông'],[],['Đã có sổ'],"['Nhà ngõ, hẻm']",[],[],[],[],['Hoàn thiện cơ bản'],[],[],['Nở hậu'],[],175 triệu/m²,"3,85 tỷ- 22 m2đ"
564,"Siêu hiếm HXH, NKKN,Q1,dt 5M X12m,Gía 11,68tỷ","12.123, Đường Nam Kỳ Khởi Nghĩa, Phường Đa Kao, Quận 1, Tp Hồ Chí Minh",[],[],[],[],[],58 m²,200 m²,5 phòng,5 phòng,4,[],5 m,12 m,['Đông'],[],['Đã có sổ'],"['Nhà ngõ, hẻm']",[],[],[],[],['Nội thất cao cấp'],[],[],['Hẻm xe hơi'],[],"201,38 triệu/m²","11,68 tỷ- 58 m2đ"
565,Bán nhà MT Đakao Q.1 4×20m 5tầng hđt 65tr giá 21ty,"Đường Nguyễn Văn Thủ, Phường Đa Kao, Quận 1, Tp Hồ Chí Minh",[],[],[],[],[],80 m²,400 m²,nhiều hơn 10 phòng,Nhiều hơn 6 phòng,[],[],4 m,20 m,[],[],['Đã có sổ'],"['Nhà mặt phố, mặt tiền']",[],[],[],[],['Nội thất cao cấp'],[],[],['Nở hậu'],[],"262,5 triệu/m²",21 tỷ- 80 m2đ
566,Nhà thích hợp di chuyển qua các quận trong TP,"Đường Phan Tôn||2839, Phường Đa Kao, Quận 1, Tp Hồ Chí Minh",[],[],[],[],[],48 m²,48 m²,4 phòng,3 phòng,[],[],6 m,8 m,[],[],[],"['Nhà ngõ, hẻm']",[],[],[],[],[],[],[],[],[],"112,5 triệu/m²","5,4 tỷ- 48 m2đ"
567,Nhà ở Q.1.thích hợp di chuyển các quận,"lê văn tám, Phường Đa Kao, Quận 1, Tp Hồ Chí Minh",[],[],[],[],[],48 m²,48 m²,4 phòng,3 phòng,[],[],6 m,8 m,[],[],['Đã có sổ'],"['Nhà ngõ, hẻm']",[],[],[],[],[],[],[],[],[],"112,5 triệu/m²","5,4 tỷ- 48 m2đ"
568,"Bán nhà HXH 3 lầu đường Nguyễn Thái Học,Q.1- 8 tỷ","Đường Nguyễn Thái Học, Phường Cầu Ông Lãnh, Quận 1, Tp Hồ Chí Minh",[],[],[],[],[],41.2 m²,123.5 m²,2 phòng,3 phòng,[],[],4.2 m,9.85 m,[],[],[],"['Nhà ngõ, hẻm']",[],[],[],[],[],[],[],['Hẻm xe hơi'],[],"195,12 triệu/m²",8 tỷ- 41.2 m2đ
569,4•Lầu Mặt Tiền 368 Kinh Dương Vương 4x14-8 phòng🔥,"370, Kinh Duong Vuowng, Phường Bến Nghé, Quận 1, Tp Hồ Chí Minh",[],[],[],[],[],50 m²,220 m²,5 phòng,5 phòng,[],[],4 m,14 m,['Đông Bắc'],[],[],"['Nhà mặt phố, mặt tiền']",[],[],[],[],[],[],[],[],[],146 triệu/m²,"7,3 tỷ- 50 m2đ"
570,"Mặt tiền Quận 1, 50m2, giá 13 tỷ TL chính chủ","68, Đường Nguyễn Cảnh Chân, Phường Cầu Kho, Quận 1, Tp Hồ Chí Minh",[],[],[],[],[],50 m²,240 m²,1 phòng,1 phòng,[],[],4 m,12 m,[],[],[],"['Nhà mặt phố, mặt tiền']",[],[],[],[],[],[],[],[],[],260 triệu/m²,13 tỷ- 50 m2đ
571,Bán Nhà HXH Nguyễn Trãi Q1 4x10m 1 lầu 8.9 tỷ,"Đường Nguyễn Trãi, Phường Nguyễn Cư Trinh, Quận 1, Tp Hồ Chí Minh",[],[],[],[],[],40 m²,[],5 phòng,5 phòng,[],[],4 m,10 m,[],[],[],"['Nhà ngõ, hẻm']",[],[],[],[],[],[],[],[],[],"222,5 triệu/m²","8,9 tỷ- 40 m2đ"
572,"Bán nhà chính chủ, hẻm xe hoi tới nhà","88/89, Nguyễn Van Quy, Phường Nguyễn Cư Trinh, Quận 1, Tp Hồ Chí Minh",[],[],[],[],[],81 m²,158 m²,3 phòng,4 phòng,[],[],4 m,20 m,['Tây Nam'],[],['Đã có sổ'],"['Nhà mặt phố, mặt tiền']",[],[],[],[],[],[],[],['Hẻm xe hơi'],[],"60,49 triệu/m²","4,9 tỷ- 81 m2đ"
573,MT TRẦN HƯNG ĐẠO . PHƯỜNG NGUYỄN CƯ TRINH . QUẬN 1,"Đường Trần Hưng Đạo, Phường Nguyễn Cư Trinh, Quận 1, Tp Hồ Chí Minh",[],[],[],[],[],78 m²,[],6 phòng,Nhiều hơn 6 phòng,6,[],4 m,20 m,[],[],['Đã có sổ'],"['Nhà mặt phố, mặt tiền']",[],[],[],[],['Nội thất cao cấp'],[],[],"['Hẻm xe hơi', 'Nở hậu']",[],"282,05 triệu/m²",22 tỷ- 78 m2đ
574,4•Lầu Mặt Tiền 368 Kinh Dương Vương 4x14-8 phòng✅,"370, Kinh duong vuong, Phường Cầu Kho, Quận 1, Tp Hồ Chí Minh",[],[],[],[],[],45 m²,220 m²,8 phòng,4 phòng,[],[],4 m,14 m,['Đông Bắc'],[],[],"['Nhà ngõ, hẻm']",[],[],[],[],[],[],[],[],[],"162,22 triệu/m²","7,3 tỷ- 45 m2đ"
575,"Nhà mặt tiền 66.5m2, Đg Ng. Thái Bình, Q.1","Nguyễn Thái Bình, Phường Nguyễn Thái Bình, Quận 1, Tp Hồ Chí Minh",[],[],[],[],[],67 m²,261 m²,4 phòng,3 phòng,4,[],4 m,18 m,[],[],['Đã có sổ'],"['Nhà mặt phố, mặt tiền']",[],[],[],[],['Hoàn thiện cơ bản'],[],[],[],[],"746,27 triệu/m²",50 tỷ- 67 m2đ
576,"NHÀ CÁC CỤ CẦN BÁN GẤP NHÀ HẺM NGUYỄN TRÃI,Q.1-4X9","45/2, Đường Nguyễn Trãi, Phường Nguyễn Cư Trinh, Quận 1, Tp Hồ Chí Minh",[],[],[],[],[],35 m²,37 m²,3 phòng,3 phòng,2,[],4 m,9 m,[],[],['Đã có sổ'],"['Nhà ngõ, hẻm']",[],[],[],[],[],[],[],['Hẻm xe hơi'],[],"242,86 triệu/m²","8,5 tỷ- 35 m2đ"
577,"Bán gấp nhà 2MT HXH đg Nguyễn Trãi,Q.1-5x7m-8,7tỉ","32/12, Đường Nguyễn Trãi, Phường Nguyễn Cư Trinh, Quận 1, Tp Hồ Chí Minh",[],[],[],[],[],34 m²,35 m²,2 phòng,2 phòng,2,[],5 m,7 m,[],[],['Đã có sổ'],"['Nhà ngõ, hẻm']",[],[],[],[],[],[],[],['Hẻm xe hơi'],[],"255,88 triệu/m²","8,7 tỷ- 34 m2đ"
578,"NHÀ MT ĐƯỜNG HỒ HẢO HỚN, NGANG 4.6X18M","39df, Đường Hồ Hảo Hớn, Phường Cô Giang, Quận 1, Tp Hồ Chí Minh",[],[],[],[],[],75 m²,200 m²,3 phòng,2 phòng,3,[],4.5 m,18 m,[],[],['Đã có sổ'],"['Nhà mặt phố, mặt tiền']",[],[],[],[],[],[],[],[],[],344 triệu/m²,"25,8 tỷ- 75 m2đ"
579,"KET VỐN BÁN GẤP NHÀ Q1, DT: 22m2, Giá: 2ty6, SHR","không số, Đường Nguyễn Phi Khanh, Phường Tân Định, Quận 1, Tp Hồ Chí Minh",[],[],[],[],[],22 m²,22 m²,2 phòng,2 phòng,2,[],3 m,8 m,[],[],['Đã có sổ'],"['Nhà ngõ, hẻm']",[],[],[],[],['Nội thất đầy đủ'],[],[],[],[],"118,18 triệu/m²","2,6 tỷ- 22 m2đ"
580,Chính chủ nhà1 trệt 2 lầu quận 1 26m2,"Đường Nguyễn Văn Nguyễn, Phường Tân Định, Quận 1, Tp Hồ Chí Minh",[],[],[],[],[],26 m²,110 m²,2 phòng,3 phòng,[],[],4 m,8 m,[],[],[],"['Nhà ngõ, hẻm']",[],[],[],[],[],[],[],[],[],"334,62 triệu/m²","8,7 tỷ- 26 m2đ"
581,"Nhà 1 lung, 2 gác ( miễn trung gian)","68/212, Đường Trần Quang Khải, Phường Tân Định, Quận 1, Tp Hồ Chí Minh",[],[],[],[],[],15.6 m²,30.5 m²,1 phòng,1 phòng,[],[],2.8 m,6.2 m,['Đông Bắc'],[],['Đã có sổ'],"['Nhà ngõ, hẻm']",[],[],[],[],['Bàn giao thô'],[],[],"['Hẻm xe hơi', 'Nở hậu']",[],"233,33 triệu/m²","3,5 tỷ- 15.6 m2đ"
582,"Cần bán biệt thự Nguyễn Thị Minh Khai, Đa Kao","Nguyễn Thị Minh Khai, Phường Đa Kao, Quận 1, Tp Hồ Chí Minh",[],[],[],[],[],120 m²,[],3 phòng,3 phòng,[],[],12 m,10 m,[],[],[],['Nhà biệt thự'],[],[],[],[],[],[],[],[],[],225 triệu/m²,27 tỷ- 120 m2đ
583,Bán 2 MT HXH 6m nguyễn trãi 5x7m trệt lầu giá 8.9T,"Đường Nguyễn Trãi, Phường Nguyễn Cư Trinh, Quận 1, Tp Hồ Chí Minh",[],[],[],[],[],33 m²,66 m²,2 phòng,2 phòng,[],[],5 m,7 m,[],[],['Đã có sổ'],"['Nhà ngõ, hẻm']",[],[],[],[],[],[],[],[],[],"269,7 triệu/m²","8,9 tỷ- 33 m2đ"
