,title,address,project_name,apartment_code,block_name,block_code,square,square_area,square_in_use,bedroom,wc,num_floor,floor,width,height,door,balcony,certificates,house_type,estate_type,office_type,apartment_type,status,furniture_status,estate_status,apartment_specific,house_specific,_type,price_m2,price_square
0,MT TRẦN HƯNG ĐẠO . PHƯỜNG NGUYỄN CƯ TRINH . QUẬN 1,"Đường Trần Hưng Đạo, Phường Nguyễn Cư Trinh, Quận 1, Tp Hồ Chí Minh",[],[],[],[],[],78 m²,[],6 phòng,Nhiều hơn 6 phòng,6,[],4 m,20 m,[],[],['Đã có sổ'],"['Nhà mặt phố, mặt tiền']",[],[],[],[],['Nội thất cao cấp'],[],[],"['Hẻm xe hơi', 'Nở hậu']",[],"282,05 triệu/m²",22 tỷ- 78 m2đ
1,"Bán nhà chính chủ, hẻm xe hoi tới nhà","88/89, Nguyễn Van Quy, Phường Nguyễn Cư Trinh, Quận 1, Tp Hồ Chí Minh",[],[],[],[],[],81 m²,158 m²,3 phòng,4 phòng,[],[],4 m,20 m,['Tây Nam'],[],['Đã có sổ'],"['Nhà mặt phố, mặt tiền']",[],[],[],[],[],[],[],['Hẻm xe hơi'],[],"60,49 triệu/m²","4,9 tỷ- 81 m2đ"
2,"Bán Nhà Nguyễn Trãi , 5 lầu 19P Thu Nhập 120tr/th","Đường Nguyễn Trãi, Phường Nguyễn Cư Trinh, Quận 1, Tp Hồ Chí Minh",[],[],[],[],[],125 m²,[],10 phòng,Nhiều hơn 6 phòng,6,[],[],[],[],[],['Đã có sổ'],"['Nhà ngõ, hẻm']",[],[],[],[],[],[],[],[],[],148 triệu/m²,"18,5 tỷ
GIÁ TỐT
- 125 m2đ"
3,Bán khách sạn mặt tiền đường NGUYỄN AN NINH P BẾN,"34, Đường Nguyễn An Ninh, Phường Bến Thành, Quận 1, Tp Hồ Chí Minh",[],[],[],[],[],87 m²,473 m²,7 phòng,Nhiều hơn 6 phòng,9,[],4 m,22 m,[],[],['Đã có sổ'],"['Nhà mặt phố, mặt tiền']",[],[],[],[],[],[],[],['Nở hậu'],[],"1,137931034 tỷ/m²",99 tỷ- 87 m2đ
4,DO CHUYỂN NHÀ RA HÀ NỘI BÁN GẤP TRẦN ĐÌNH XU Q.1,"Đường Trần Đình Xu, Phường Cô Giang, Quận 1, Tp Hồ Chí Minh",[],[],[],[],[],58 m²,58 m²,4 phòng,3 phòng,[],[],5 m,11 m,[],[],['Đã có sổ'],"['Nhà ngõ, hẻm']",[],[],[],[],[],[],[],"['Hẻm xe hơi', 'Nở hậu']",[],"32,07 triệu/m²","1,86 tỷ- 58 m2đ"
5,"Nhà hẻm 18A Nguyễn Thị Minh Khai, P.ĐK, Q.1, 4,7tỷ","Đường Nguyễn Thị Minh Khai, Phường Đa Kao, Quận 1, Tp Hồ Chí Minh",[],[],[],[],[],18 m²,[],3 phòng,4 phòng,[],[],[],[],[],[],[],"['Nhà ngõ, hẻm']",[],[],[],[],[],[],[],[],[],"261,11 triệu/m²","4,7 tỷ- 18 m2đ"
6,"NHÀ HẺM 214B NGUYỄN TRÃI 3,7 x 13 TRỆT 1 LẦU 2PN","nguyễn trãi, Phường Nguyễn Cư Trinh, Quận 1, Tp Hồ Chí Minh",[],[],[],[],[],40 m²,80 m²,2 phòng,3 phòng,2,[],4 m,13 m,[],[],['Đã có sổ'],"['Nhà ngõ, hẻm']",[],[],[],[],[],[],[],"['Hẻm xe hơi', 'Nở hậu']",[],"132,5 triệu/m²","5,3 tỷ- 40 m2đ"
7,"Nhà hẻm Nguyễn Bỉnh Khiêm,P.ĐK, Q.1, 28m2, 3,6tỷ","Nguyễn Bỉnh Khiêm, Phường Đa Kao, Quận 1, Tp Hồ Chí Minh",[],[],[],[],[],28 m²,[],2 phòng,2 phòng,[],[],[],[],[],[],[],"['Nhà ngõ, hẻm']",[],[],[],[],[],[],[],[],[],"128,57 triệu/m²","3,6 tỷ- 28 m2đ"
8,CHUYỂN NHÀ BÁN GẤP NGUYỄN BỈNH KHIÊM P.ĐA KAO Q.1,"Đường Nguyễn Bỉnh Khiêm, Phường Đa Kao, Quận 1, Tp Hồ Chí Minh",[],[],[],[],[],56 m²,112 m²,5 phòng,4 phòng,[],[],5 m,11 m,[],[],['Đã có sổ'],"['Nhà ngõ, hẻm']",[],[],[],[],[],[],[],"['Hẻm xe hơi', 'Nở hậu']",[],"23,93 triệu/m²","1,34 tỷ- 56 m2đ"
9,"NHÀ VỊ TRÍ ĐẸP NGAY MẠC THỊ BƯỞI,Q1,32m2,CHỈ 984tr","Đường Mạc Thị Bưởi, Phường Bến Nghé, Quận 1, Tp Hồ Chí Minh",[],[],[],[],[],32 m²,[],2 phòng,2 phòng,[],[],4 m,8 m,[],[],['Đã có sổ'],"['Nhà ngõ, hẻm']",[],[],[],[],[],[],[],['Hẻm xe hơi'],[],"30,75 triệu/m²",984 triệu- 32 m2đ
10,Bán nhà đầu ve hẻm 459 Trần Hưng Đạo,"459, Đường Trần Hưng Đạo, Phường Cầu Kho, Quận 1, Tp Hồ Chí Minh",[],[],[],[],[],25.6 m²,58.1 m²,2 phòng,2 phòng,[],[],3.2 m,8 m,['Tây Nam'],[],['Đã có sổ'],"['Nhà ngõ, hẻm']",[],[],[],[],['Bàn giao thô'],[],[],['Hẻm xe hơi'],[],268 triệu/m²,"6,7 tỷ- 25.6 m2đ"
11,"Bán nhà VIP MT Trần Quang Khải 4,4 x 17m, 5L. 31T","Đường Trần Quang Khải, Phường Tân Định, Quận 1, Tp Hồ Chí Minh",[],[],[],[],[],75 m²,500 m²,8 phòng,Nhiều hơn 6 phòng,[],[],4.4 m,17 m,[],[],['Đã có sổ'],"['Nhà mặt phố, mặt tiền']",[],[],[],[],[],[],[],[],[],"413,33 triệu/m²",31 tỷ- 75 m2đ
12,Bán nhà hẻm Nguyễn Thị Minh Khai Q1 -Sổ riêng 40m2,"Đường Nguyễn Thị Minh Khai, Phường Đa Kao, Quận 1, Tp Hồ Chí Minh",[],[],[],[],[],40 m²,[],2 phòng,2 phòng,[],[],[],[],[],[],['Đã có sổ'],"['Nhà ngõ, hẻm']",[],[],[],[],[],[],[],['Hẻm xe hơi'],[],35 triệu/m²,"1,4 tỷ- 40 m2đ"
13,"Nhà Q.1 giá cực rẻ chỉ 3.88 tỷ, 29m2, 1 trệt 2 lầu","Đường Nguyễn Văn Nguyễn, Phường Tân Định, Quận 1, Tp Hồ Chí Minh",[],[],[],[],[],29 m²,[],3 phòng,3 phòng,[],[],[],[],[],[],[],"['Nhà ngõ, hẻm']",[],[],[],[],[],[],[],[],[],"133,79 triệu/m²","3,88 tỷ- 29 m2đ"
14,Nhà bán hẻm xe hơi 8m hoàng sa p Đakao Q1,"75, Đường Hoàng Sa, Phường Đa Kao, Quận 1, Tp Hồ Chí Minh",[],[],[],[],[],70 m²,214 m²,4 phòng,5 phòng,4,[],4 m,17 m,[],[],['Đã có sổ'],"['Nhà ngõ, hẻm']",[],[],[],[],['Nội thất cao cấp'],[],[],['Hẻm xe hơi'],[],"254,29 triệu/m²","17,8 tỷ- 70 m2đ"
15,Nhà Mặt Tiền Q1,"Đường Calmette, Phường Nguyễn Thái Bình, Quận 1, Tp Hồ Chí Minh",[],[],[],[],[],76 m²,76 m²,3 phòng,2 phòng,2,[],4 m,19 m,[],[],['Đã có sổ'],"['Nhà mặt phố, mặt tiền']",[],[],[],[],[],[],[],"['Hẻm xe hơi', 'Nở hậu']",[],500 triệu/m²,38 tỷ- 76 m2đ
16,GĐ CẦN TIỀN BÁN GẤP NHÀ NGUYỄN TRÃI QUẬN 1 46M2 SH,"Đường Nguyễn Trãi, Phường Phạm Ngũ Lão, Quận 1, Tp Hồ Chí Minh",[],[],[],[],[],46 m²,[],2 phòng,2 phòng,[],[],[],[],[],[],['Đã có sổ'],"['Nhà ngõ, hẻm']",[],[],[],[],[],[],[],"['Hẻm xe hơi', 'Nở hậu']",[],"33,26 triệu/m²","1,53 tỷ- 46 m2đ"
17,Nhà Hẻm Xe hơi Đỗ Cửa Q1. Giá Chỉ 5 Tỷ Hàng Hiếm,"15, Đường Trần Đình Xu, Phường Cầu Kho, Quận 1, Tp Hồ Chí Minh",[],[],[],[],[],21 m²,65 m²,2 phòng,2 phòng,[],[],36 m,6 m,['Tây Nam'],[],[],"['Nhà ngõ, hẻm']",[],[],[],[],[],[],[],[],[],"238,1 triệu/m²",5 tỷ- 21 m2đ
18,Bán tòa nhà CHDV khu phố Tây NTMK Q1. Gía 41ty,"Đường Nguyễn Thị Minh Khai, Phường Đa Kao, Quận 1, Tp Hồ Chí Minh",[],[],[],[],[],108 m²,500 m²,nhiều hơn 10 phòng,Nhiều hơn 6 phòng,[],[],6 m,18 m,[],[],[],"['Nhà ngõ, hẻm']",[],[],[],[],[],[],[],[],[],"379,63 triệu/m²",41 tỷ- 108 m2đ
19,Cân bán Gâp nhà hėm Lương Hưu khánh Q1 .,"Lương Hưu Khánh, Phường Phạm Ngũ Lão, Quận 1, Tp Hồ Chí Minh",[],[],[],[],[],27 m²,80 m²,4 phòng,4 phòng,[],[],3 m,11 m,[],[],[],"['Nhà ngõ, hẻm']",[],[],[],[],[],[],[],[],[],"203,7 triệu/m²","5,5 tỷ- 27 m2đ"
20,Chính chủ bán nhà Trần Khắc Chân Q1 25m2 giá2ty150,"Đường Trần Khắc Chân, Phường Tân Định, Quận 1, Tp Hồ Chí Minh",[],[],[],[],[],25 m²,50 m²,2 phòng,2 phòng,[],[],3.5 m,7 m,[],[],[],"['Nhà ngõ, hẻm']",[],[],[],[],[],[],[],[],[],86.000 đ/m²,"2,15 triệu- 25 m2đ"
21,Hẻm 6m 457/ Trần Hưng Đạo đúc 4.5 tấm,"457, Đường Trần Hưng Đạo, Phường Cầu Kho, Quận 1, Tp Hồ Chí Minh",[],[],[],[],[],32 m²,122.03 m²,5 phòng,4 phòng,[],[],3 m,12.5 m,['Tây Nam'],[],['Đã có sổ'],"['Nhà ngõ, hẻm']",[],[],[],[],['Hoàn thiện cơ bản'],[],[],"['Hẻm xe hơi', 'Nở hậu']",[],"437,5 triệu/m²",14 tỷ- 32 m2đ
22,"Bán nhà chính chủ, hẻm xe hoi tới nhà","88/89, Nguyễn Van Quy, Phường Nguyễn Cư Trinh, Quận 1, Tp Hồ Chí Minh",[],[],[],[],[],81 m²,158 m²,3 phòng,4 phòng,[],[],4 m,20 m,['Tây Nam'],[],['Đã có sổ'],"['Nhà mặt phố, mặt tiền']",[],[],[],[],[],[],[],['Hẻm xe hơi'],[],"60,49 triệu/m²","4,9 tỷ- 81 m2đ"
23,MT TRẦN HƯNG ĐẠO . PHƯỜNG NGUYỄN CƯ TRINH . QUẬN 1,"Đường Trần Hưng Đạo, Phường Nguyễn Cư Trinh, Quận 1, Tp Hồ Chí Minh",[],[],[],[],[],78 m²,[],6 phòng,Nhiều hơn 6 phòng,6,[],4 m,20 m,[],[],['Đã có sổ'],"['Nhà mặt phố, mặt tiền']",[],[],[],[],['Nội thất cao cấp'],[],[],"['Hẻm xe hơi', 'Nở hậu']",[],"282,05 triệu/m²",22 tỷ- 78 m2đ
24,"Chính chủ bán nhà hẻm xe hơi đường Võ Văn Kiệt, Q1","Đường Võ Văn Kiệt, Phường Cầu Kho, Quận 1, Tp Hồ Chí Minh",[],[],[],[],[],62 m²,62 m²,2 phòng,1 phòng,1,[],3.3 m,18.9 m,['Tây Nam'],[],['Đã có sổ'],"['Nhà ngõ, hẻm']",[],[],[],[],[],[],[],['Hẻm xe hơi'],[],"129,03 triệu/m²",8 tỷ- 62 m2đ
25,"Bán nhà Trần Quang Khải 3tỷ250 40,8m2","Đường Trần Quang Khải, Phường Tân Định, Quận 1, Tp Hồ Chí Minh",[],[],[],[],[],41 m²,41 m²,6 phòng,4 phòng,[],[],6 m,7 m,[],[],['Đã có sổ'],"['Nhà ngõ, hẻm']",[],[],[],[],[],[],[],['Nở hậu'],[],79.268 đ/m²,"3,25 triệu- 41 m2đ"
26,"CẦN TIỀN BÁN NHÀ TRẦN KHẮC CHÂN Q1, DT:46M2, 899TR","Đường Trần Khắc Chân, Phường Tân Định, Quận 1, Tp Hồ Chí Minh",[],[],[],[],[],46 m²,[],2 phòng,3 phòng,1,[],5 m,9 m,[],[],['Đã có sổ'],"['Nhà ngõ, hẻm']",[],[],[],[],['Hoàn thiện cơ bản'],[],[],['Hẻm xe hơi'],[],"19,54 triệu/m²",899 triệu- 46 m2đ
27,"BÁN NHÀ MT ĐƯỜNG HÒA MỸ, ĐAKAO, QUẬN 1, GIÁ 2tỷ450","Đường Hòa Mỹ, Phường Đa Kao, Quận 1, Tp Hồ Chí Minh",[],[],[],[],[],40 m²,40 m²,3 phòng,3 phòng,[],[],4 m,10 m,[],[],['Đã có sổ'],"['Nhà ngõ, hẻm']",[],[],[],[],[],[],[],['Hẻm xe hơi'],[],"61,25 triệu/m²","2,45 tỷ- 40 m2đ"
28,"CHÍNH CHỦ CẦN BÁN NHÀ HXH , QUẬN 1","Đường Trần Khắc Chân, Phường Tân Định, Quận 1, Tp Hồ Chí Minh",[],[],[],[],[],32 m²,[],3 phòng,3 phòng,3,[],[],[],['Bắc'],[],['Đã có sổ'],"['Nhà ngõ, hẻm']",[],[],[],[],[],[],[],"['Hẻm xe hơi', 'Nở hậu']",[],500 triệu/m²,16 tỷ- 32 m2đ
29,Nhà 1 trệt 3 lầu 140m2.. 393 Trẩn Hưng đạo q1,"393, Đường Trần Hưng Đạo||2859, Phường Cầu Kho, Quận 1, Tp Hồ Chí Minh",[],393,nhà phố liền kể,[],[],140 m²,101 m²,3 phòng,3 phòng,4,[],7 m,5.5 m,['Đông Bắc'],[],['Đã có sổ'],"['Nhà mặt phố, mặt tiền']",[],[],[],[],['Nội thất cao cấp'],[],[],"['Hẻm xe hơi', 'Nở hậu']",[],"70,71 triệu/m²","9,9 tỷ- 140 m2đ"
30,MT Nguyễn Văn Cừ Q1 dt:4.2m x 14m 3lầu 1sân thượng,"Đường Nguyễn Cư Trinh, Phường Nguyễn Cư Trinh, Quận 1, Tp Hồ Chí Minh",[],[],[],[],[],48 m²,160 m²,3 phòng,4 phòng,[],[],4.2 m,14 m,[],[],['Đã có sổ'],"['Nhà mặt phố, mặt tiền']",[],[],[],[],[],[],[],[],[],"229,17 triệu/m²",11 tỷ- 48 m2đ
31,"Nhà 1trệt1 lầu,44m2,Nguyễn Thị Minh Khai,Đa Kao,Q1","Đường Nguyễn Thị Minh Khai, Phường Đa Kao, Quận 1, Tp Hồ Chí Minh",[],[],[],[],[],44 m²,88 m²,2 phòng,3 phòng,2,[],4 m,11 m,[],[],['Đã có sổ'],"['Nhà ngõ, hẻm']",[],[],[],[],['Nội thất đầy đủ'],[],[],"['Hẻm xe hơi', 'Nở hậu']",[],"42,05 triệu/m²","1,85 tỷ- 44 m2đ"
32,Chính chủ cần bán Gấp 212/170 Nguyễn Văn Nguyễn,"212/170, Đường Nguyễn Văn Nguyễn, Phường Tân Định, Quận 1, Tp Hồ Chí Minh",[],[],[],[],[],25 m²,107 m²,3 phòng,3 phòng,[],[],3.2 m,8.2 m,['Đông Bắc'],[],[],"['Nhà mặt phố, mặt tiền']",[],[],[],[],[],[],[],[],[],348 triệu/m²,"8,7 tỷ- 25 m2đ"
33,HXH Trần Đình Xu F.NCTQ1 dt:3m x 11m 1L 2L 1ST,"Đường Trần Đình Xu, Phường Nguyễn Cư Trinh, Quận 1, Tp Hồ Chí Minh",[],[],[],[],[],30 m²,120 m²,3 phòng,3 phòng,[],[],3 m,11 m,[],[],['Đã có sổ'],"['Nhà ngõ, hẻm']",[],[],[],[],[],[],[],['Hẻm xe hơi'],[],"183,33 triệu/m²","5,5 tỷ- 30 m2đ"
34,Nhà CC 84m2 (172tr/m2) HXeTai Phạm Viết Chánh Q1,"Phạm Viết Chánh, Phường Nguyễn Cư Trinh, Quận 1, Tp Hồ Chí Minh",[],[],[],[],[],84.8 m²,[],2 phòng,2 phòng,1,[],3.7 m,23 m,[],[],['Đã có sổ'],"['Nhà ngõ, hẻm']",[],[],[],[],['Hoàn thiện cơ bản'],[],[],"['Hẻm xe hơi', 'Nở hậu']",[],"172,62 triệu/m²","14,5 tỷ- 84.8 m2đ"
35,Cần Bán Nhà Mặt Tiền Nguyễn Bỉnh Khiêm ( Đoạn Đep),"Đường Nguyễn Bỉnh Khiêm, Phường Đa Kao, Quận 1, Tp Hồ Chí Minh",[],[],[],[],[],30 m²,60 m²,3 phòng,2 phòng,[],[],3 m,8.5 m,[],[],['Đã có sổ'],"['Nhà mặt phố, mặt tiền']",[],[],[],[],[],[],[],"['Hẻm xe hơi', 'Nở hậu']",[],"218,33 triệu/m²","6,55 tỷ- 30 m2đ"
36,2MT Hoàng Sa khu KDMB đông đúc dt:4.7m x 11m 1 lầu,"Đường Hoàng Sa, Phường Tân Định, Quận 1, Tp Hồ Chí Minh",[],[],[],[],[],40 m²,100 m²,2 phòng,2 phòng,[],[],4.7 m,11 m,[],[],['Đã có sổ'],"['Nhà mặt phố, mặt tiền']",[],[],[],[],[],[],[],[],[],"212,5 triệu/m²","8,5 tỷ- 40 m2đ"
37,❌Hàng Vip Hxhoi Nguyễn Đình Chiểu Q1 (30m2)1L 5TỶ,"Đường Nguyễn Đình Chiểu, Phường Đa Kao, Quận 1, Tp Hồ Chí Minh",[],[],[],[],[],29 m²,[],2 phòng,2 phòng,1,[],3.7 m,9 m,[],[],['Đã có sổ'],"['Nhà ngõ, hẻm']",[],[],[],[],['Hoàn thiện cơ bản'],[],[],"['Hẻm xe hơi', 'Nở hậu']",[],"172,41 triệu/m²",5 tỷ- 29 m2đ
38,"Bán nhà phố hẻm xe hơi 46 Trần Đình Xu, Quận 1,HCM","Trần Đình Xu, Phường Cô Giang, Quận 1, Tp Hồ Chí Minh",[],[],[],[],[],20.8 m²,104 m²,3 phòng,4 phòng,4,[],3 m,7 m,['Bắc'],[],['Đã có sổ'],"['Nhà ngõ, hẻm']",[],[],[],[],['Nội thất cao cấp'],[],[],['Hẻm xe hơi'],[],299 triệu/m²,"5,98 tỷ- 20.8 m2đ"
39,MT Phạm Ngũ Lão P.PNL Q1 dt: 4m x 26m 1 lững 7 lầu,"Đường Phạm Ngũ Lão, Phường Phạm Ngũ Lão, Quận 1, Tp Hồ Chí Minh",[],[],[],[],[],105 m²,735 m²,nhiều hơn 10 phòng,Nhiều hơn 6 phòng,[],[],4 m,26 m,[],[],['Đã có sổ'],"['Nhà mặt phố, mặt tiền']",[],[],[],[],[],[],[],[],[],"361,9 triệu/m²",38 tỷ- 105 m2đ
40,❌Hàng Vip HXTAI Tân Định Q1 (4x14m)3Lau 12 Tỷ,"Đường Trần Khắc Chân, Phường Tân Định, Quận 1, Tp Hồ Chí Minh",[],[],[],[],[],53 m²,[],5 phòng,5 phòng,3,[],4 m,14 m,[],[],['Đã có sổ'],"['Nhà ngõ, hẻm']",[],[],[],[],['Hoàn thiện cơ bản'],[],[],"['Hẻm xe hơi', 'Nở hậu']",[],"226,42 triệu/m²",12 tỷ- 53 m2đ
41,"Không có căn thứ 2 ở Bùi Thị Xuân, Q1, 1T2L,5.8 tỷ","Đường Bùi Thị Xuân, Phường Phạm Ngũ Lão, Quận 1, Tp Hồ Chí Minh",[],[],[],[],[],36 m²,90 m²,3 phòng,2 phòng,[],[],3 m,12 m,[],[],['Đã có sổ'],"['Nhà ngõ, hẻm']",[],[],[],[],[],[],[],['Hẻm xe hơi'],[],"161,11 triệu/m²","5,8 tỷ- 36 m2đ"
42,HẺM XE Ô TÔ 93M2 - ĐƯỜNG NGUYỄN HỮU CẢNH - QUẬN 1,"Võ Duy Ninh, Phường Bến Nghé, Quận 1, Tp Hồ Chí Minh",[],[],[],[],[],93 m²,93 m²,1 phòng,[],[],[],5 m,19 m,[],[],['Đã có sổ'],"['Nhà ngõ, hẻm']",[],[],[],[],[],[],[],['Hẻm xe hơi'],[],"93,44 triệu/m²","8,69 tỷ- 93 m2đ"
43,Nhà Quận 1 - 1 trệt 1 lửng 1 lầu 1 ST 150m2,"155/, Đường Cô Bắc, Phường Cô Giang, Quận 1, Tp Hồ Chí Minh",[],[],[],[],[],46 m²,150 m²,6 phòng,6 phòng,[],[],3 m,18 m,['Đông Bắc'],[],['Đã có sổ'],"['Nhà ngõ, hẻm']",[],[],[],[],['Nội thất đầy đủ'],[],[],[],[],"141,3 triệu/m²","6,5 tỷ- 46 m2đ"
44,"Bán nhà chính chủ, hẻm xe hoi tới nhà","88/89, Nguyễn Van Quy, Phường Nguyễn Cư Trinh, Quận 1, Tp Hồ Chí Minh",[],[],[],[],[],81 m²,158 m²,3 phòng,4 phòng,[],[],4 m,20 m,['Tây Nam'],[],['Đã có sổ'],"['Nhà mặt phố, mặt tiền']",[],[],[],[],[],[],[],['Hẻm xe hơi'],[],"60,49 triệu/m²","4,9 tỷ- 81 m2đ"
45,MT TRẦN HƯNG ĐẠO . PHƯỜNG NGUYỄN CƯ TRINH . QUẬN 1,"Đường Trần Hưng Đạo, Phường Nguyễn Cư Trinh, Quận 1, Tp Hồ Chí Minh",[],[],[],[],[],78 m²,[],6 phòng,Nhiều hơn 6 phòng,6,[],4 m,20 m,[],[],['Đã có sổ'],"['Nhà mặt phố, mặt tiền']",[],[],[],[],['Nội thất cao cấp'],[],[],"['Hẻm xe hơi', 'Nở hậu']",[],"282,05 triệu/m²",22 tỷ- 78 m2đ
46,Cần chuyển đi bán nhà hẻm cấp 4,"Đường Nguyễn Đình Chiểu, Phường Đa Kao, Quận 1, Tp Hồ Chí Minh",[],[],[],[],[],43.5 m²,69.9 m²,2 phòng,2 phòng,[],[],6 m,7.5 m,[],[],['Đã có sổ'],"['Nhà ngõ, hẻm']",[],[],[],[],['Hoàn thiện cơ bản'],[],[],[],[],"151,16 triệu/m²","6,5 tỷ- 43.5 m2đ"
47,Bán nhà chính chủ Q1 chưa qua đầu tư 67m2 giá rẻ,"6a/, Đường Nguyễn Cảnh Chân, Phường Nguyễn Cư Trinh, Quận 1, Tp Hồ Chí Minh",[],[],[],[],[],67 m²,73 m²,3 phòng,2 phòng,[],[],6 m,11 m,['Tây Nam'],[],['Đã có sổ'],"['Nhà ngõ, hẻm']",[],[],[],[],['Hoàn thiện cơ bản'],[],[],['Nở hậu'],[],"162,69 triệu/m²","10,9 tỷ- 67 m2đ"
48,Nhà nhỏ quận 1,"hẻm, Đường Bến Chương Dương, Phường Cầu Kho, Quận 1, Tp Hồ Chí Minh",[],[],[],[],[],10 m²,35 m²,2 phòng,2 phòng,3,[],2.6 m,3 m,[],[],['Đã có sổ'],"['Nhà ngõ, hẻm']",[],[],[],[],[],[],[],[],[],230.000 đ/m²,"2,3 triệu- 10 m2đ"
49,MẶT TIỀN ĐƯỜNG VÕ THỊ SÁU - QUẬN 1,"Đường Võ Thị Sáu, Phường Đa Kao, Quận 1, Tp Hồ Chí Minh",[],[],[],[],[],180 m²,180 m²,2 phòng,2 phòng,[],[],9 m,20 m,[],[],['Đã có sổ'],['Nhà phố liền kề'],[],[],[],[],[],[],[],[],[],"372,22 triệu/m²",67 tỷ- 180 m2đ
50,"Bán nhà 14/10C Calmette, Q.1, chính chủ.","Đường Calmette, Phường Nguyễn Thái Bình, Quận 1, Tp Hồ Chí Minh",[],[],[],[],[],48 m²,[],4 phòng,5 phòng,3,[],[],[],['Tây Bắc'],[],['Đã có sổ'],"['Nhà ngõ, hẻm']",[],[],[],[],['Nội thất cao cấp'],[],[],['Nở hậu'],[],"164,58 triệu/m²","7,9 tỷ- 48 m2đ"
51,"Bán nhà mới 5 lầu Trần Hưng Đạo Q1, 34m2 4.95 tỷ","Đường Trần Hưng Đạo, Phường Cầu Kho, Quận 1, Tp Hồ Chí Minh",[],[],[],[],[],34 m²,150 m²,3 phòng,5 phòng,5,[],4 m,8 m,[],[],['Đã có sổ'],"['Nhà ngõ, hẻm']",[],[],[],[],[],[],[],"['Hẻm xe hơi', 'Nở hậu']",[],"144,12 triệu/m²","4,9 tỷ- 34 m2đ"
52,"Nhà mặt tiền đường Huỳnh Khương Ninh, P Đa Kao, Q1","Đường Huỳnh Khương Ninh, Phường Đa Kao, Quận 1, Tp Hồ Chí Minh",[],[],[],[],[],82 m²,326 m²,6 phòng,3 phòng,[],[],38 m,216 m,['Tây Bắc'],[],['Đã có sổ'],"['Nhà mặt phố, mặt tiền']",[],[],[],[],[],[],[],['Nở hậu'],[],"317,07 triệu/m²",26 tỷ- 82 m2đ
53,KẸT VỐN KINH DOANH BÁN NHÀ ĐINH TIÊN HOÀNG Q1 69m2,"Đường Đinh Tiên Hoàng, Phường Đa Kao, Quận 1, Tp Hồ Chí Minh",[],[],[],[],[],69 m²,207 m²,3 phòng,4 phòng,[],[],6 m,11.5 m,[],[],['Đã có sổ'],"['Nhà ngõ, hẻm']",[],[],[],[],[],[],[],"['Hẻm xe hơi', 'Nở hậu']",[],"21,12 triệu/m²","1,457 tỷ- 69 m2đ"
54,"CHÍNH CHỦ BÁN GẤP NHÀ HXH TRẦN HƯNG ĐẠO,Q1,41M SHR","Đường Trần Hưng Đạo, Phường Phạm Ngũ Lão, Quận 1, Tp Hồ Chí Minh",[],[],[],[],[],41 m²,[],2 phòng,2 phòng,1,[],3.5 m,11.7 m,[],[],['Đã có sổ'],"['Nhà ngõ, hẻm']",[],[],[],[],['Hoàn thiện cơ bản'],[],[],"['Hẻm xe hơi', 'Nở hậu']",[],"23,17 triệu/m²",950 triệu- 41 m2đ
55,"Bán nhà 54m2 đ.Điện Biên Phủ, p.Đa kao, q.1","Đường Điện Biên Phủ, Phường Đa Kao, Quận 1, Tp Hồ Chí Minh",[],[],[],[],[],54 m²,[],2 phòng,3 phòng,[],[],4.5 m,12 m,[],[],['Đã có sổ'],"['Nhà ngõ, hẻm']",[],[],[],[],['Hoàn thiện cơ bản'],[],[],"['Hẻm xe hơi', 'Nở hậu']",[],"43,52 triệu/m²","2,35 tỷ- 54 m2đ"
56,"Q1 Nguyễn Cảnh Chân 3.2x13m ,trệt lửng 3 lầu 1st","Đường Nguyễn Cảnh Chân, Phường Cầu Kho, Quận 1, Tp Hồ Chí Minh",[],[],[],[],[],37 m²,156 m²,5 phòng,3 phòng,4,[],3.2 m,13 m,['Tây Nam'],[],['Đã có sổ'],"['Nhà ngõ, hẻm']",[],[],[],[],['Nội thất đầy đủ'],[],[],[],[],"232,43 triệu/m²","8,6 tỷ- 37 m2đ"
57,ai thiện chí lh chính chủ 09097116năm năm,"Đường Trần Khắc Chân, Phường Tân Định, Quận 1, Tp Hồ Chí Minh",[],[],[],[],[],56.55 m²,[],6 phòng,3 phòng,[],[],3.9 m,14.5 m,[],[],['Đã có sổ'],"['Nhà ngõ, hẻm']",[],[],[],[],[],[],[],['Hẻm xe hơi'],[],"205,36 triệu/m²","11,5 tỷ- 56.55 m2đ"
58,"Bán KS 3 sao mặt tiền Nguyễn Trãi, Q1","180 - 182 - 184, Đường Nguyễn Trãi, Phường Bến Thành, Quận 1, Tp Hồ Chí Minh",[],[],[],[],[],235.46 m²,1824.66 m²,nhiều hơn 10 phòng,Nhiều hơn 6 phòng,8,[],12 m,20 m,['Đông Nam'],[],['Đã có sổ'],"['Nhà mặt phố, mặt tiền']",[],[],[],[],['Nội thất đầy đủ'],[],[],['Nở hậu'],[],"1,234042553 tỷ/m²",290 tỷ- 235.46 m2đ
59,Bán Nhà Trung Tâm Quận 1,"21/6 trịnh văn cấn p cầu ông lãnh q1 tphcm, Phường Cầu Ông Lãnh, Quận 1, Tp Hồ Chí Minh",[],[],[],[],[],55.7 m²,55.7 m²,7 phòng,6 phòng,[],[],3.5 m,16 m,['Đông Nam'],[],['Đã có sổ'],"['Nhà ngõ, hẻm']",[],[],[],[],['Bàn giao thô'],[],[],[],[],"234,55 triệu/m²","12,9 tỷ- 55.7 m2đ"
60,Mặt Tiền 1468 Hai Bà Trưng 90m2 4 Tầng,"=> Gọi 0833083123 & 0902187404, Xem Nhà 13 Nguyễn 608 Thượng 42/44B Kiệm Xu Hiền 4 Đình 1277B Trần 136/24 Lê Đức Thọ, Phường Bến Thành, Quận 1, Tp Hồ Chí Minh",[],[],[],[],[],8765 m²,[],nhiều hơn 10 phòng,[],[],[],[],[],[],[],[],"['Nhà mặt phố, mặt tiền']",[],[],[],[],[],[],[],[],['Cần mua'],"2,19 triệu/m²","19,2 tỷ- 8.765 m2đ"
61,Nhà MT 8m 1578 Lê Thánh Tôn 326M2 4 Tầng,"=> Gọi 0833083123 & 0902187404, Xem Nhà 13 Nguyễn 608 Thượng 42/44B Kiệm Xu Hiền 4 Đình 1277B Trần 136/24 Lê Đức Thọ, Phường Bến Thành, Quận 1, Tp Hồ Chí Minh",[],[],[],[],[],8765 m²,[],nhiều hơn 10 phòng,[],[],[],[],[],[],[],[],"['Nhà mặt phố, mặt tiền']",[],[],[],[],[],[],[],[],['Cần mua'],"2,62 triệu/m²",23 tỷ- 8.765 m2đ
62,CHDV 1387 Nguyễn Tất Thành 3500M2 10 TẦNG,"=> Gọi 0833083123 & 0902187404, Xem Nhà 13 Nguyễn 608 Thượng 42/44B Kiệm Xu Hiền 4 Đình 1277B Trần 136/24 Lê Đức Thọ, Phường Bến Thành, Quận 1, Tp Hồ Chí Minh",[],[],[],[],[],8763 m²,[],nhiều hơn 10 phòng,[],[],[],[],[],[],[],[],"['Nhà mặt phố, mặt tiền']",[],[],[],[],[],[],[],[],['Cần mua'],"4,56 triệu/m²",40 tỷ- 8.763 m2đ
63,Mặt Tiền 1875 Nguyễn Trãi 758M2 3 Tầng,"=> Gọi 0833083123 & 0902187404, Xem Nhà 13 Nguyễn 608 Thượng 42/44B Kiệm Xu Hiền 4 Đình 1277B Trần 136/24 Lê Đức Thọ, Phường Bến Thành, Quận 1, Tp Hồ Chí Minh",[],[],[],[],[],8765 m²,[],nhiều hơn 10 phòng,[],[],[],[],[],[],[],[],"['Nhà mặt phố, mặt tiền']",[],[],[],[],[],[],[],[],['Cần mua'],"6,27 triệu/m²",55 tỷ- 8.765 m2đ
64,Bán Nhà mới xây 61/12 Cô Giang,"Đường Cô Giang, Phường Cô Giang, Quận 1, Tp Hồ Chí Minh",[],[],[],[],[],72.7 m²,214 m²,6 phòng,[],[],[],3.9 m,19 m,[],[],['Đã có sổ'],"['Nhà mặt phố, mặt tiền']",[],[],[],[],[],[],[],['Hẻm xe hơi'],[],"319,44 triệu/m²",23 tỷ- 72.7 m2đ
65,Bán khách sạn mới xây ngay đường Nguyễn Trãi,"Đường Nguyễn Trãi, Phường Bến Thành, Quận 1, Tp Hồ Chí Minh",[],[],[],[],[],56 m²,220 m²,nhiều hơn 10 phòng,Nhiều hơn 6 phòng,[],[],3.9 m,14.4 m,[],[],['Đã có sổ'],"['Nhà mặt phố, mặt tiền']",[],[],[],[],[],[],[],['Hẻm xe hơi'],[],"392,86 triệu/m²",22 tỷ- 56 m2đ
66,"Bán nhà chính chủ, hẻm xe hoi tới nhà","88/89, Nguyễn Van Quy, Phường Nguyễn Cư Trinh, Quận 1, Tp Hồ Chí Minh",[],[],[],[],[],81 m²,158 m²,3 phòng,4 phòng,[],[],4 m,20 m,['Tây Nam'],[],['Đã có sổ'],"['Nhà mặt phố, mặt tiền']",[],[],[],[],[],[],[],['Hẻm xe hơi'],[],"60,49 triệu/m²","4,9 tỷ- 81 m2đ"
67,MT TRẦN HƯNG ĐẠO . PHƯỜNG NGUYỄN CƯ TRINH . QUẬN 1,"Đường Trần Hưng Đạo, Phường Nguyễn Cư Trinh, Quận 1, Tp Hồ Chí Minh",[],[],[],[],[],78 m²,[],6 phòng,Nhiều hơn 6 phòng,6,[],4 m,20 m,[],[],['Đã có sổ'],"['Nhà mặt phố, mặt tiền']",[],[],[],[],['Nội thất cao cấp'],[],[],"['Hẻm xe hơi', 'Nở hậu']",[],"282,05 triệu/m²",22 tỷ- 78 m2đ
68,"Nhà đẹp mặt tiền Trần Khắc Chân, Q.1, 7tỷ2. Có sổ","Đường Trần Khắc Chân, Phường Tân Định, Quận 1, Tp Hồ Chí Minh",[],[],[],[],[],85 m²,[],4 phòng,[],[],[],[],[],[],[],['Đã có sổ'],"['Nhà mặt phố, mặt tiền']",[],[],[],[],['Nội thất cao cấp'],[],[],[],[],"84,71 triệu/m²","7,2 tỷ- 85 m2đ"
69,"Mặt tiềnTrương Hán Siêu Đakao,Q.1,77m2 chỉ 16.5 tỷ","Đường Trương Hán Siêu, Phường Đa Kao, Quận 1, Tp Hồ Chí Minh",[],[],[],[],[],77 m²,308 m²,6 phòng,Nhiều hơn 6 phòng,[],[],4 m,18 m,[],[],['Đã có sổ'],"['Nhà mặt phố, mặt tiền']",[],[],[],[],[],[],[],[],[],"214,29 triệu/m²","16,5 tỷ- 77 m2đ"
70,Bán nhà hẻm 2m cách MT Hồ Hảo Hớn 5m 1t1l 26m2,"Đường Hồ Hảo Hớn, Phường Cô Giang, Quận 1, Tp Hồ Chí Minh",[],[],[],[],[],26 m²,51 m²,1 phòng,2 phòng,[],[],[],[],[],[],['Đã có sổ'],"['Nhà ngõ, hẻm']",[],[],[],[],[],[],[],['Nở hậu'],[],200 triệu/m²,"5,2 tỷ- 26 m2đ"
71,Bán nhà HXH Đinh Tiên Hoàng ( Ngang 4 ; dài 10 ),"Đường Đinh Tiên Hoàng, Phường Đa Kao, Quận 1, Tp Hồ Chí Minh",[],[],[],[],[],38 m²,[],1 phòng,1 phòng,[],[],[],[],[],[],['Đã có sổ'],"['Nhà mặt phố, mặt tiền']",[],[],[],[],[],[],[],['Hẻm xe hơi'],[],"210,53 triệu/m²",8 tỷ- 38 m2đ
